Match ID,Duración (s),Modo de juego,Parche,Equipo Ganador,Equipo,Invocador,Campeón,Runas,Hechizos,K/D/A,Daño total,Daño recibido,Oro acumulado,Objetos,Racha Asesinatos,Daño a Torres,Daño a Dragones/Barones,Asistencias,Barón Kills,Nivel de recompensa,Experiencia,Nivel,Pings - All In,Pings - Assist Me,Pings - Enemy Missing,Kills,Deaths,Double Kills,Triple Kills,Quadra Kills,Penta Kills,Dragon Kills,Inhibitor Kills,Torre Destruida,Nexus Kills,Total Minions,Total Heal,Total CC,Total Time Dead,Vision Score,Wards Puestos,Wards Destruidos
EUW1_7282893253,1582,CLASSIC,15.2.652.1536,Blue,Blue,dravensamira,Kalista,Desconocido (Desconocido),"4, 21",10/7/6,21597,23354,13939,"Blade of The Ruined King, Guinsoo's Rageblade, Desconocido, B. F. Sword, Berserker's Greaves, Doran's Blade, Farsight Alteration",2,8383,17961,6,0,10,12325,14,8,14,10,10,7,1,0,0,0,0,0,3,1,186,7815,282,176,20,7,6
EUW1_7282893253,1582,CLASSIC,15.2.652.1536,Blue,Blue,Tirtourne,Maokai,Desconocido (Desconocido),"14, 4",4/7/19,13731,31672,9455,"Desconocido, Locket of the Iron Solari, Control Ward, Desconocido, Desconocido, Plated Steelcaps, Oracle Lens",0,855,8681,19,0,4,10097,13,5,0,3,4,7,0,0,0,0,0,1,1,0,31,10612,270,111,60,21,3
EUW1_7282893253,1582,CLASSIC,15.2.652.1536,Blue,Red,kenono,Kayle,Desconocido (Desconocido),"4, 12",5/8/3,13333,20163,9799,"Boots of Swiftness, Guinsoo's Rageblade, Rabadon's Deathcap, Doran's Ring, Blighting Jewel, Desconocido, Stealth Ward",2,6720,7337,3,0,5,12188,14,0,8,1,5,8,1,0,0,0,0,0,2,0,147,4545,230,176,12,8,1
EUW1_7282893253,1582,CLASSIC,15.2.652.1536,Blue,Red,Αkashí,Ivern,Desconocido (Desconocido),"4, 11",1/8/16,15275,18111,9322,"Desconocido, Redemption, Moonstone Renewer, Desconocido, Ionian Boots of Lucidity, Desconocido, Oracle Lens",0,569,7521,16,0,1,9962,13,0,5,5,1,8,0,0,0,0,0,0,0,0,7,6214,535,223,16,4,2
EUW1_7282893253,1582,CLASSIC,15.2.652.1536,Blue,Red,Ag0ny,Qiyana,Desconocido (Desconocido),"4, 12",4/6/5,15423,22643,9379,"Desconocido, Desconocido, Last Whisper, Ionian Boots of Lucidity, Long Sword, Long Sword, Oracle Lens",2,1833,1833,5,0,4,12048,14,0,1,4,4,6,0,0,0,0,0,0,1,0,157,1311,113,192,13,2,2
EUW1_7282893253,1582,CLASSIC,15.2.652.1536,Blue,Red,01062023,Ezreal,Desconocido (Desconocido),"21, 4",8/9/8,32549,26255,11083,"Muramana, Control Ward, Serylda's Grudge, Ionian Boots of Lucidity, Trinity Force, Long Sword, Farsight Alteration",3,5848,9512,8,0,8,10749,13,0,2,1,8,9,1,0,0,0,0,0,2,0,164,4690,6,240,23,10,7
EUW1_7282893253,1582,CLASSIC,15.2.652.1536,Blue,Red,FireAscept,Poppy,Desconocido (Desconocido),"4, 14",8/5/10,23373,22637,9490,"Locket of the Iron Solari, Control Ward, Desconocido, Mercury's Treads, Kindlegem, Dead Man's Plate, Oracle Lens",4,1743,1743,10,0,8,7765,11,4,0,2,8,5,0,0,0,0,0,0,0,0,26,1735,325,106,70,38,3
