Match ID,Duración (s),Modo de juego,Parche,Equipo Ganador,Equipo,Invocador,Campeón,Runas,Hechizos,K/D/A,Daño total,Daño recibido,Oro acumulado,Objetos,Racha Asesinatos,Daño a Torres,Daño a Dragones/Barones,Asistencias,Barón Kills,Nivel de recompensa,Experiencia,Nivel,Pings - All In,Pings - Assist Me,Pings - Enemy Missing,Kills,Deaths,Double Kills,Triple Kills,Quadra Kills,Penta Kills,Dragon Kills,Inhibitor Kills,Torre Destruida,Nexus Kills,Total Minions,Total Heal,Total CC,Total Time Dead,Vision Score,Wards Puestos,Wards Destruidos
EUW1_7286224164,1528,CLASSIC,15.2.652.1536,Blue,Blue,raikooooo,Katarina,Desconocido (Desconocido),"4, 12",17/7/8,31108,28445,13259,"Lich Bane, Rabadon's Deathcap, Control Ward, Desconocido, Dark Seal, Shadowflame, Oracle Lens",6,2209,9250,8,0,17,13038,15,1,6,20,17,7,5,3,1,0,0,0,1,0,149,3664,65,234,15,5,3
EUW1_7286224164,1528,CLASSIC,15.2.652.1536,Blue,Blue,G2 Dracarys,Ezreal,Desconocido (Desconocido),"21, 4",4/9/6,19991,22214,10469,"Manamune, Ionian Boots of Lucidity, Doran's Blade, Trinity Force, Desconocido, Pickaxe, Farsight Alteration",2,7760,8063,6,0,4,11387,13,0,0,1,4,9,1,0,0,0,0,0,2,0,163,2637,65,237,11,5,3
EUW1_7286224164,1528,CLASSIC,15.2.652.1536,Blue,Blue,Walid Georgey,Karma,Desconocido (Desconocido),"4, 7",3/3/27,19333,11929,8902,"Desconocido, Bandleglass Mirror, Oblivion Orb, Imperial Mandate, Desconocido, Aether Wisp, Oracle Lens",2,2902,5176,27,0,3,11218,13,1,0,1,3,3,0,0,0,0,0,0,0,0,31,2568,201,46,86,39,12
EUW1_7286224164,1528,CLASSIC,15.2.652.1536,Blue,Red,cadianNN,KSante,Desconocido (Desconocido),"4, 12",2/6/10,23500,29895,8384,"Desconocido, Chain Vest, Control Ward, Plated Steelcaps, Null-Magic Mantle, Thornmail, Stealth Ward",2,0,0,10,0,2,11955,14,0,1,6,2,6,1,0,0,0,0,0,0,0,167,4756,384,172,12,7,1
EUW1_7286224164,1528,CLASSIC,15.2.652.1536,Blue,Red,Ferrettt,XinZhao,Desconocido (Desconocido),"4, 11",6/9/11,22048,45772,10147,"Tiamat, Desconocido, Black Cleaver, Ruby Crystal, Plated Steelcaps, Giant's Belt, Oracle Lens",2,2037,8985,11,0,6,9928,12,1,2,9,6,9,0,0,0,0,0,0,1,0,22,20816,559,202,18,2,4
EUW1_7286224164,1528,CLASSIC,15.2.652.1536,Blue,Red,VJBYYTF0AO,Akali,Desconocido (Desconocido),"4, 12",7/12/5,23672,30434,9420,"Shadowflame, Desconocido, Amplifying Tome, Sorcerer's Shoes, Doran's Ring, Dark Seal, Oracle Lens",3,4449,4837,5,0,7,9964,13,0,2,12,7,12,0,0,0,0,0,0,1,0,132,491,69,316,16,5,1
EUW1_7286224164,1528,CLASSIC,15.2.652.1536,Blue,Red,,MissFortune,Desconocido (Desconocido),"4, 21",11/6/7,23609,17683,12265,"Doran's Blade, Youmuu's Ghostblade, Lord Dominik's Regards, Boots of Swiftness, The Collector, Serrated Dirk, Farsight Alteration",2,1480,3381,7,0,11,10303,13,0,1,3,11,6,0,0,0,0,0,0,1,0,162,1806,88,199,18,10,2
EUW1_7286224164,1528,CLASSIC,15.2.652.1536,Blue,Red,jonezbonez,Lulu,Desconocido (Desconocido),"4, 7",1/7/20,8470,16739,7567,"Desconocido, Redemption, Moonstone Renewer, Oblivion Orb, Ionian Boots of Lucidity, Control Ward, Oracle Lens",0,281,6065,20,0,1,8618,12,0,1,17,1,7,0,0,0,0,0,0,0,0,19,2723,286,169,53,32,5
EUW1_7286188743,807,CLASSIC,15.2.652.1536,Red,Blue,VJBYYTF0AO,Jayce,Desconocido (Desconocido),"4, 12",4/1/0,12077,8657,6636,"Spear Of Shojin, Refillable Potion, Desconocido, Plated Steelcaps, Doran's Blade, Tear of the Goddess, Farsight Alteration",4,4390,4480,0,0,4,7864,11,0,0,6,4,1,0,0,0,0,0,0,0,0,122,1320,100,12,9,7,0
EUW1_7286188743,807,CLASSIC,15.2.652.1536,Red,Blue,,Nocturne,Desconocido (Desconocido),"4, 11",0/3/1,4790,13133,4268,"Mosstomper Seedling, Stridebreaker, Long Sword, Desconocido, Slightly Magical Footwear, Desconocido, Oracle Lens",0,0,5062,1,0,0,4858,8,0,3,7,0,3,0,0,0,0,0,0,0,0,7,7913,171,42,12,2,3
EUW1_7286188743,807,CLASSIC,15.2.652.1536,Red,Blue,BDSnuc,Ambessa,Desconocido (Desconocido),"4, 12",1/2/0,10223,9038,4458,"Desconocido, Desconocido, Desconocido, Doran's Blade, Boots, Desconocido, Oracle Lens",0,0,0,0,0,1,6061,9,0,0,9,1,2,0,0,0,0,0,0,0,0,101,2001,63,44,11,5,0
EUW1_7286188743,807,CLASSIC,15.2.652.1536,Red,Blue,,Caitlyn,Desconocido (Desconocido),"1, 4",1/4/0,7040,7687,4305,"Doran's Blade, The Collector, Desconocido, Boots, Desconocido, Desconocido, Stealth Ward",0,1117,1117,0,0,1,4956,8,0,4,6,1,4,0,0,0,0,0,0,0,0,95,1145,31,75,6,5,0
EUW1_7286188743,807,CLASSIC,15.2.652.1536,Red,Blue,G2H2K Łúcíƒër,Janna,Desconocido (Desconocido),"7, 4",0/1/1,1887,3866,2840,"Desconocido, Ionian Boots of Lucidity, Faerie Charm, Kindlegem, Desconocido, Desconocido, Oracle Lens",0,196,196,1,0,0,2053,5,0,6,2,0,1,0,0,0,0,0,0,0,0,11,985,37,14,11,5,1
EUW1_7286188743,807,CLASSIC,15.2.652.1536,Red,Red,Sqim v3,Tryndamere,Desconocido (Desconocido),"14, 4",2/1/0,7215,16487,5174,"Ravenous Hydra, Doran's Shield, Dagger, Dagger, Boots, Desconocido, Stealth Ward",0,682,682,0,0,2,7104,10,0,0,0,2,1,0,0,0,0,0,0,0,0,119,7936,34,25,4,3,0
EUW1_7286188743,807,CLASSIC,15.2.652.1536,Red,Red,Hallohihi,Elise,Desconocido (Desconocido),"4, 11",3/1/2,6300,11607,4998,"Sorcerer's Shoes, Hextech Alternator, Aether Wisp, Dark Seal, Gustwalker Hatchling, Desconocido, Oracle Lens",3,853,15021,2,0,3,4684,8,0,2,3,3,1,0,0,0,0,1,0,0,0,6,7974,101,20,11,4,2
EUW1_7286188743,807,CLASSIC,15.2.652.1536,Red,Red,,Yone,Desconocido (Desconocido),"4, 12",2/3/1,5225,11110,4730,"Vampiric Scepter, Refillable Potion, Berserker's Greaves, Pickaxe, Recurve Bow, Doran's Shield, Stealth Ward",2,955,955,1,0,2,6323,10,0,2,0,2,3,0,0,0,0,0,0,0,0,88,1568,62,67,6,5,2
EUW1_7286188743,807,CLASSIC,15.2.652.1536,Red,Red,ADexapunch,Kalista,Desconocido (Desconocido),"21, 4",2/0/3,4198,5876,6141,"Berserker's Greaves, Blade of The Ruined King, Recurve Bow, Control Ward, Doran's Blade, Desconocido, Farsight Alteration",2,2449,3485,3,0,2,5238,9,0,6,14,2,0,0,0,0,0,0,0,1,0,121,1887,164,0,12,6,2
EUW1_7286188743,807,CLASSIC,15.2.652.1536,Red,Red,keia,Neeko,Desconocido (Desconocido),"7, 4",2/1/4,5509,5083,4508,"Refillable Potion, Desconocido, Hextech Rocketbelt, Boots of Swiftness, Amplifying Tome, Desconocido, Oracle Lens",0,1551,3756,4,0,2,3857,7,0,1,1,2,1,0,0,0,0,0,0,0,0,17,1021,51,16,9,5,3
EUW1_7285934196,2267,CLASSIC,15.2.652.1536,Blue,Blue,Iziio,Yone,Desconocido (Desconocido),"4, 12",6/5/8,38942,37209,15457,"Berserker's Greaves, Desconocido, Doran's Blade, Infinity Edge, Immortal Shieldbow, Blade of The Ruined King, Oracle Lens",2,4078,6407,8,0,6,22784,18,0,1,2,6,5,0,0,0,0,0,1,1,0,304,13324,235,222,27,10,3
EUW1_7285934196,2267,CLASSIC,15.2.652.1536,Blue,Blue,Ferrettt,Kindred,Desconocido (Desconocido),"4, 11",4/5/7,19178,46893,14229,"Black Cleaver, Trinity Force, Plated Steelcaps, Desconocido, Rapid Firecannon, Long Sword, Oracle Lens",2,8780,21913,7,0,4,18436,18,0,5,23,4,5,1,0,0,0,1,0,4,1,42,28677,417,188,42,4,13
EUW1_7285934196,2267,CLASSIC,15.2.652.1536,Blue,Blue,VJBYYTF0AO,Ahri,Desconocido (Desconocido),"4, 12",7/1/12,35224,35678,17821,"Zhonya's Hourglass, Desconocido, Horizon Focus, Void Staff, Mejai's Soulstealer, Ionian Boots of Lucidity, Oracle Lens",7,2905,8913,12,1,7,23712,18,0,7,23,7,1,2,1,0,0,0,0,1,0,332,10419,166,60,37,12,7
EUW1_7285934196,2267,CLASSIC,15.2.652.1536,Blue,Blue,Mishigu,Mel,Desconocido (Desconocido),"12, 4",10/4/12,41300,23230,18237,"Void Staff, Desconocido, Boots of Swiftness, Liandry's Anguish, Shadowflame, Mejai's Soulstealer, Farsight Alteration",8,7402,14352,12,0,10,21992,18,0,5,4,10,4,1,0,0,0,0,0,3,0,301,1909,755,69,15,9,4
EUW1_7285934196,2267,CLASSIC,15.2.652.1536,Blue,Blue,Biotic2,Zilean,Desconocido (Desconocido),"4, 7",3/7/22,8164,31099,10561,"Locket of the Iron Solari, Redemption, Abyssal Mask, Desconocido, Desconocido, Ionian Boots of Lucidity, Oracle Lens",2,1836,2776,22,0,3,15730,16,2,6,4,3,7,0,0,0,0,0,0,1,0,30,12371,144,175,109,55,9
EUW1_7285934196,2267,CLASSIC,15.2.652.1536,Blue,Red,BABO TOP,Renekton,Desconocido (Desconocido),"12, 4",4/5/6,16401,47448,15070,"Spirit Visage, Control Ward, Sterak's Gage, Desconocido, Force of Nature, Eclipse, Oracle Lens",4,18562,33305,6,0,4,17972,17,0,2,3,4,5,0,0,0,0,0,0,6,0,235,10245,85,193,42,8,4
EUW1_7285934196,2267,CLASSIC,15.2.652.1536,Blue,Red,TM Anonymouss,Karthus,Desconocido (Desconocido),"4, 11",4/6/10,52415,45980,15761,"Liandry's Anguish, Desconocido, Desconocido, Needlessly Large Rod, Needlessly Large Rod, Shadowflame, Oracle Lens",3,2280,65879,10,1,4,21285,18,0,18,3,4,6,0,0,0,0,3,0,0,0,77,18966,315,255,39,5,6
EUW1_7285934196,2267,CLASSIC,15.2.652.1536,Blue,Red,SeRiN1,Corki,Desconocido (Desconocido),"4, 12",3/8/3,26707,32902,17411,"Muramana, Infinity Edge, Desconocido, Trinity Force, Lord Dominik's Regards, Noonquiver, Farsight Alteration",0,4529,8867,3,0,3,20817,18,1,4,17,3,8,0,0,0,0,0,1,0,0,350,4144,119,309,25,11,5
EUW1_7285934196,2267,CLASSIC,15.2.652.1536,Blue,Red,SUPPØRT Alive,Jhin,Desconocido (Desconocido),"4, 21",5/7/12,28520,29714,16045,"The Collector, Desconocido, Infinity Edge, Rapid Firecannon, Lord Dominik's Regards, Vampiric Scepter, Farsight Alteration",2,3348,20965,12,0,5,16689,17,0,1,12,5,7,0,0,0,0,0,1,2,0,258,7178,146,232,15,8,2
EUW1_7285934196,2267,CLASSIC,15.2.652.1536,Blue,Red,the voıces,Rell,Desconocido (Desconocido),"4, 14",5/4/13,15170,31252,11042,"Desconocido, Desconocido, Locket of the Iron Solari, Desconocido, Desconocido, Negatron Cloak, Oracle Lens",2,1199,1645,13,0,5,13699,15,1,3,4,5,4,0,0,0,0,0,0,1,0,30,5280,147,98,118,59,11
EUW1_7285729235,1177,CLASSIC,15.2.652.1536,Blue,Blue,Vizícsacsi,Gnar,Desconocido (Desconocido),"12, 4",2/1/2,11291,10118,8167,"Desconocido, Desconocido, Ruby Crystal, Trinity Force, Plated Steelcaps, Doran's Blade, Stealth Ward",0,3152,6611,2,0,2,11014,13,0,0,3,2,1,0,0,0,0,0,0,1,0,191,1688,202,40,22,8,2
EUW1_7285729235,1177,CLASSIC,15.2.652.1536,Blue,Blue,Razørk Activoo,Pantheon,Desconocido (Desconocido),"4, 11",7/1/4,15844,20967,8872,"Desconocido, Desconocido, Plated Steelcaps, Black Cleaver, Desconocido, Desconocido, Oracle Lens",6,606,30526,4,0,7,9555,12,2,4,10,7,1,3,0,0,0,2,0,0,0,10,13482,219,28,17,5,2
EUW1_7285729235,1177,CLASSIC,15.2.652.1536,Blue,Blue,,Akali,Desconocido (Desconocido),"14, 4",6/2/2,15703,9925,9550,"Doran's Ring, Boots, Needlessly Large Rod, Dark Seal, Desconocido, Shadowflame, Oracle Lens",4,2746,2746,2,0,6,11835,14,0,0,15,6,2,0,0,0,0,0,0,2,0,180,1138,44,40,15,4,6
EUW1_7285729235,1177,CLASSIC,15.2.652.1536,Blue,Blue,João ,Syndra,Desconocido (Desconocido),"4, 12",3/2/9,8111,8942,7825,"Cosmic Drive, Desconocido, Desconocido, Desconocido, Desconocido, Desconocido, Farsight Alteration",2,2147,2613,9,0,3,8152,11,0,13,5,3,2,0,0,0,0,0,0,0,0,136,1029,261,49,15,7,3
EUW1_7285729235,1177,CLASSIC,15.2.652.1536,Blue,Blue,,Poppy,Desconocido (Desconocido),"4, 14",0/4/9,6549,10107,4914,"Locket of the Iron Solari, Desconocido, Ruby Crystal, Plated Steelcaps, Desconocido, Control Ward, Oracle Lens",0,404,404,9,0,0,4608,8,0,2,3,0,4,0,0,0,0,0,0,0,0,14,1167,86,54,49,26,4
EUW1_7285729235,1177,CLASSIC,15.2.652.1536,Blue,Red,,Darius,Desconocido (Desconocido),"4, 6",0/1/0,4921,8738,5900,"Doran's Shield, Trinity Force, Plated Steelcaps, Ruby Crystal, Long Sword, Desconocido, Farsight Alteration",0,1064,1064,0,0,0,9617,12,0,5,2,0,1,0,0,0,0,0,0,0,0,144,1208,32,35,10,7,0
EUW1_7285729235,1177,CLASSIC,15.2.652.1536,Blue,Red,omnishαmbles,Vi,Desconocido (Desconocido),"4, 11",3/2/3,7590,17657,8341,"Black Cleaver, Desconocido, Ruby Crystal, Slightly Magical Footwear, Desconocido, Desconocido, Oracle Lens",3,0,22912,3,0,3,9501,12,6,9,2,3,2,0,0,0,0,1,0,0,0,8,10151,204,50,15,4,2
EUW1_7285729235,1177,CLASSIC,15.2.652.1536,Blue,Red,VJBYYTF0AO,Sylas,Desconocido (Desconocido),"4, 12",4/5/2,12203,20373,6751,"Hextech Rocketbelt, Fiendish Codex, Kindlegem, Doran's Ring, Dark Seal, Boots, Oracle Lens",2,0,830,2,0,4,9637,12,1,3,7,4,5,0,0,0,0,0,0,0,0,142,4112,237,135,12,4,1
EUW1_7285729235,1177,CLASSIC,15.2.652.1536,Blue,Red,Park Jaé hyuk,Kalista,Desconocido (Desconocido),"1, 4",1/5/1,5300,12838,6449,"Blade of The Ruined King, Berserker's Greaves, Recurve Bow, Amplifying Tome, Dagger, Doran's Blade, Farsight Alteration",0,1098,1266,1,0,1,7935,11,0,0,3,1,5,0,0,0,0,0,0,0,0,148,2143,190,131,9,5,1
EUW1_7285729235,1177,CLASSIC,15.2.652.1536,Blue,Red,zta,Elise,Desconocido (Desconocido),"4, 14",2/5/4,8596,14330,5546,"Desconocido, Ionian Boots of Lucidity, Desconocido, Desconocido, Ruby Crystal, Desconocido, Oracle Lens",0,0,0,4,0,2,5060,9,0,6,7,2,5,0,0,0,0,0,0,0,0,19,1952,36,91,51,26,4
EUW1_7284375045,1741,CLASSIC,15.2.652.1536,Blue,Blue,VJBYYTF0AO,Rumble,Desconocido (Desconocido),"4, 12",6/3/12,46704,28980,13549,"Zhonya's Hourglass, Riftmaker, Desconocido, Liandry's Anguish, Desconocido, Dark Seal, Oracle Lens",2,2935,11430,12,0,6,17779,17,0,3,7,6,3,0,0,0,0,0,0,2,0,208,4286,378,124,31,10,4
EUW1_7284375045,1741,CLASSIC,15.2.652.1536,Blue,Blue,DYN HUMMELU,Viego,Desconocido (Desconocido),"4, 11",6/4/11,24840,46010,12364,"Titanic Hydra, Kraken Slayer, Black Cleaver, Desconocido, Desconocido, Slightly Magical Footwear, Oracle Lens",3,7369,53485,11,1,6,17122,17,2,0,10,6,4,1,0,0,0,2,0,2,0,17,25878,142,110,18,7,1
EUW1_7284375045,1741,CLASSIC,15.2.652.1536,Blue,Blue,Decay0,Corki,Desconocido (Desconocido),"12, 4",10/5/6,43178,26998,14871,"Doran's Blade, Muramana, Pickaxe, Plated Steelcaps, Trinity Force, Lord Dominik's Regards, Farsight Alteration",5,9645,9987,6,0,10,16546,17,0,1,1,10,5,2,0,0,0,0,1,3,0,236,3844,64,210,24,14,2
EUW1_7284375045,1741,CLASSIC,15.2.652.1536,Blue,Blue,TH Bellingham,Kaisa,Desconocido (Desconocido),"4, 1",10/7/7,26613,20651,12798,"Desconocido, Kraken Slayer, Doran's Blade, Guinsoo's Rageblade, Desconocido, Desconocido, Farsight Alteration",5,5602,32702,7,0,10,14582,15,2,6,4,10,7,3,1,0,0,0,0,2,0,160,2875,25,182,21,9,6
EUW1_7284375045,1741,CLASSIC,15.2.652.1536,Blue,Blue,CT 9904,Rakan,Desconocido (Desconocido),"4, 14",2/10/17,8603,27347,8912,"Locket of the Iron Solari, Desconocido, Desconocido, Control Ward, Kindlegem, Mercury's Treads, Oracle Lens",0,3041,3384,17,0,2,9735,12,0,22,14,2,10,0,0,0,0,0,0,0,0,32,6392,124,264,87,41,9
EUW1_7284375045,1741,CLASSIC,15.2.652.1536,Blue,Red,qweruasdf,Jayce,Desconocido (Desconocido),"12, 4",5/9/6,23907,33964,10275,"Fimbulwinter, Null-Magic Mantle, Plated Steelcaps, Phage, Hullbreaker, Kindlegem, Farsight Alteration",3,1124,1836,6,0,5,13563,15,0,1,0,5,9,1,0,0,0,0,0,0,0,202,3053,156,253,13,10,1
EUW1_7284375045,1741,CLASSIC,15.2.652.1536,Blue,Red,Kämusari,MonkeyKing,Desconocido (Desconocido),"4, 11",9/5/11,28131,47535,12169,"Black Cleaver, Trinity Force, Desconocido, Plated Steelcaps, Null-Magic Mantle, Long Sword, Oracle Lens",4,0,19605,11,0,9,13490,15,2,10,11,9,5,1,0,0,0,2,0,0,0,28,19643,265,127,53,8,14
EUW1_7284375045,1741,CLASSIC,15.2.652.1536,Blue,Red,Opossos,Zilean,Desconocido (Desconocido),"4, 12",1/4/17,19805,27719,9883,"Seraph's Embrace, Horizon Focus, Ionian Boots of Lucidity, Fiendish Codex, Kindlegem, Doran's Ring, Stealth Ward",0,0,736,17,0,1,16442,16,0,0,9,1,4,0,0,0,0,0,0,0,0,203,12372,447,121,28,11,5
EUW1_7284375045,1741,CLASSIC,15.2.652.1536,Blue,Red,vzz3,Jhin,Desconocido (Desconocido),"4, 21",14/8/3,24652,20209,14399,"Control Ward, Lord Dominik's Regards, Rapid Firecannon, The Collector, Boots of Swiftness, Infinity Edge, Farsight Alteration",6,1519,6993,3,0,14,12830,14,0,3,7,14,8,2,0,0,0,0,0,0,0,221,3111,181,198,13,9,2
EUW1_7284375045,1741,CLASSIC,15.2.652.1536,Blue,Red,,Veigar,Desconocido (Desconocido),"4, 7",0/8/19,13859,43001,7241,"Desconocido, Heartsteel, Control Ward, Frozen Heart, Desconocido, Ionian Boots of Lucidity, Oracle Lens",0,3121,3644,19,0,0,10142,13,1,0,4,0,8,0,0,0,0,0,0,0,0,27,4750,110,216,61,27,7
EUW1_7284290642,1365,CLASSIC,15.2.652.1536,Blue,Blue,Vizícsacsi,Zac,Desconocido (Desconocido),"12, 4",3/5/6,9928,33234,8054,"Bami's Cinder, Ruby Crystal, Desconocido, Ionian Boots of Lucidity, Cloth Armor, Doran's Shield, Farsight Alteration",3,6157,7937,6,0,3,11689,14,0,1,0,3,5,0,0,0,0,0,0,2,0,131,27875,270,68,22,11,4
EUW1_7284290642,1365,CLASSIC,15.2.652.1536,Blue,Blue,Fruten Frat3n,Viego,Desconocido (Desconocido),"4, 11",4/1/13,13070,26822,10115,"Desconocido, Kraken Slayer, Plated Steelcaps, Desconocido, Ruby Crystal, Desconocido, Oracle Lens",3,3752,37571,13,0,4,12229,14,0,39,18,4,1,1,0,0,0,1,0,3,1,24,18449,186,25,21,7,3
EUW1_7284290642,1365,CLASSIC,15.2.652.1536,Blue,Blue,Pun1sher Reborn,Cassiopeia,Desconocido (Desconocido),"12, 4",13/6/10,32806,28683,12772,"Refillable Potion, Dark Seal, Liandry's Anguish, Seraph's Embrace, Rylai's Crystal Scepter, Rod of Ages, Stealth Ward",4,5901,5901,10,0,13,15096,16,2,1,1,13,6,2,0,0,0,0,0,1,0,169,10196,536,144,16,9,3
EUW1_7284290642,1365,CLASSIC,15.2.652.1536,Blue,Blue,Wesley Warren Jr,Jhin,Desconocido (Desconocido),"4, 1",12/2/10,22905,16717,12169,"Control Ward, Infinity Edge, Rapid Firecannon, Plated Steelcaps, The Collector, Doran's Blade, Farsight Alteration",5,4982,12750,10,0,12,13914,15,1,2,5,12,2,1,0,0,0,0,0,1,0,174,4898,75,69,12,7,1
EUW1_7284290642,1365,CLASSIC,15.2.652.1536,Blue,Blue,PYKE NIKE,Pyke,Desconocido (Desconocido),"4, 14",8/5/17,10460,16528,8907,"Youmuu's Ghostblade, Desconocido, Desconocido, Desconocido, Desconocido, Control Ward, Oracle Lens",4,2251,2499,17,0,8,8735,12,2,1,6,8,5,0,0,0,0,0,1,1,0,18,3589,74,85,55,29,3
EUW1_7284290642,1365,CLASSIC,15.2.652.1536,Blue,Red,sense xvenım,Jayce,Desconocido (Desconocido),"4, 12",6/6/5,27289,25689,11491,"Doran's Blade, Spear Of Shojin, Muramana, Executioner's Calling, Boots, Serylda's Grudge, Farsight Alteration",2,6099,6099,5,0,6,12919,14,0,1,5,6,6,0,0,0,0,0,0,2,0,193,2756,151,168,10,6,2
EUW1_7284290642,1365,CLASSIC,15.2.652.1536,Blue,Red,eltuko,Nidalee,Desconocido (Desconocido),"4, 11",6/5/4,16232,28130,9120,"Shadowflame, Liandry's Anguish, Desconocido, Sorcerer's Shoes, Desconocido, Desconocido, Oracle Lens",3,0,20083,4,0,6,10759,13,0,7,5,6,5,0,0,0,0,1,0,0,0,15,16619,136,151,24,4,7
EUW1_7284290642,1365,CLASSIC,15.2.652.1536,Blue,Red,RKRKZN,Smolder,Desconocido (Desconocido),"12, 4",4/11/2,21013,21540,8430,"Doran's Blade, Essence Reaver, Spear Of Shojin, Ionian Boots of Lucidity, Dagger, Desconocido, Farsight Alteration",0,948,948,2,0,4,9990,13,0,0,1,4,11,0,0,0,0,0,0,0,0,123,2143,180,284,16,9,1
EUW1_7284290642,1365,CLASSIC,15.2.652.1536,Blue,Red,Lucie Bílá L9,Corki,Desconocido (Desconocido),"4, 12",2/10/2,19587,22002,8366,"Doran's Blade, Muramana, Trinity Force, Long Sword, Boots, Long Sword, Farsight Alteration",0,174,174,2,0,2,11463,14,0,0,0,2,10,0,0,0,0,0,0,1,0,185,887,19,234,10,6,2
EUW1_7284290642,1365,CLASSIC,15.2.652.1536,Blue,Red,VJBYYTF0AO,Rell,Desconocido (Desconocido),"4, 14",1/8/7,6156,13697,5990,"Desconocido, Refillable Potion, Desconocido, Ruby Crystal, Zeke's Convergence, Plated Steelcaps, Oracle Lens",0,950,1141,7,0,1,7138,10,0,0,7,1,8,0,0,0,0,0,0,0,0,23,56,71,134,82,43,7
EUW1_7284238698,1646,CLASSIC,15.2.652.1536,Red,Blue,SMRADOCH ROBO,KSante,Desconocido (Desconocido),"4, 12",3/4/2,14737,27780,9413,"Spectre's Cowl, Fimbulwinter, Iceborn Gauntlet, Plated Steelcaps, Control Ward, Negatron Cloak, Oracle Lens",3,3190,4141,2,0,3,12382,14,0,0,0,3,4,1,0,0,0,0,0,1,0,189,2534,2403,88,16,5,1
EUW1_7284238698,1646,CLASSIC,15.2.652.1536,Red,Blue,Rhilech,Zyra,Desconocido (Desconocido),"4, 11",4/5/7,18131,19834,9147,"Shadowflame, Liandry's Anguish, Control Ward, Amplifying Tome, Sorcerer's Shoes, Amplifying Tome, Oracle Lens",3,0,18700,7,0,4,10144,13,0,11,23,4,5,0,0,0,0,0,0,0,0,24,6183,393,179,15,5,0
EUW1_7284238698,1646,CLASSIC,15.2.652.1536,Red,Blue,VJBYYTF0AO,Galio,Desconocido (Desconocido),"4, 12",4/6/1,17410,32554,8876,"Turbo Chemtank, Riftmaker, Plated Steelcaps, Desconocido, Doran's Ring, Dark Seal, Oracle Lens",2,534,716,1,0,4,11250,13,0,2,5,4,6,0,0,0,0,0,0,0,0,178,2177,103,170,27,7,5
EUW1_7284238698,1646,CLASSIC,15.2.652.1536,Red,Blue,romanian deft,Jinx,Desconocido (Desconocido),"4, 21",3/6/2,21355,17768,10330,"Pickaxe, Runaan's Hurricane, Cloak of Agility, Desconocido, B. F. Sword, Berserker's Greaves, Farsight Alteration",2,399,2899,2,0,3,11199,13,0,5,14,3,6,0,0,0,0,0,0,0,0,229,2552,36,126,24,10,5
EUW1_7284238698,1646,CLASSIC,15.2.652.1536,Red,Blue,KLUCKA FKN DELL,Milio,Desconocido (Desconocido),"4, 7",1/3/11,7086,15968,6924,"Desconocido, Moonstone Renewer, Desconocido, Desconocido, Ionian Boots of Lucidity, Dark Seal, Oracle Lens",0,310,1017,11,0,1,8768,12,0,1,7,1,3,0,0,0,0,0,0,0,0,31,9793,160,71,65,26,10
EUW1_7284238698,1646,CLASSIC,15.2.652.1536,Red,Red,Strey en mission,Garen,Desconocido (Desconocido),"14, 4",9/1/5,25637,26554,13799,"Refillable Potion, Boots of Swiftness, Stridebreaker, Dead Man's Plate, Force of Nature, Desconocido, Stealth Ward",7,6604,14195,5,0,9,16010,16,0,1,5,9,1,0,0,0,0,0,0,3,1,204,258,275,20,23,9,6
EUW1_7284238698,1646,CLASSIC,15.2.652.1536,Red,Red,Katniss Evermeme,Graves,Desconocido (Desconocido),"4, 11",6/5/7,18930,27901,12441,"Desconocido, The Collector, Youmuu's Ghostblade, Maw of Malmortius, Long Sword, Long Sword, Oracle Lens",2,2949,50762,7,1,6,16714,17,0,0,0,6,5,0,0,0,0,3,0,0,0,37,15020,669,80,20,3,3
EUW1_7284238698,1646,CLASSIC,15.2.652.1536,Red,Red,DavidGoggins Arc,Aurora,Desconocido (Desconocido),"4, 12",2/3/6,23507,22392,10397,"Doran's Ring, Shadowflame, Desconocido, Desconocido, Luden's Tempest, Dark Seal, Oracle Lens",0,4611,6604,6,0,2,16445,16,0,5,7,2,3,0,0,0,0,0,0,2,0,207,6945,250,63,15,8,0
EUW1_7284238698,1646,CLASSIC,15.2.652.1536,Red,Red,DIV Impulse,Varus,Desconocido (Desconocido),"21, 4",6/1/8,22822,13215,13121,"Doran's Blade, Muramana, Youmuu's Ghostblade, Desconocido, Serylda's Grudge, Long Sword, Farsight Alteration",5,7860,21719,8,0,6,15028,16,8,8,6,6,1,0,0,0,0,0,2,5,0,204,3519,318,12,22,10,5
EUW1_7284238698,1646,CLASSIC,15.2.652.1536,Red,Red,mersadge,Pyke,Desconocido (Desconocido),"4, 14",1/5/12,9700,18712,9023,"Desconocido, Umbral Glaive, Control Ward, Edge of Night, Boots of Swiftness, Serrated Dirk, Oracle Lens",0,1751,3560,12,0,1,9044,12,1,14,14,1,5,0,0,0,0,0,0,0,0,24,4757,61,108,88,36,12
EUW1_7283149792,1899,CLASSIC,15.2.652.1536,Blue,Blue,VJBYYTF0AO,Hwei,Desconocido (Desconocido),"4, 12",11/5/14,53356,24547,14429,"Liandry's Anguish, Seraph's Embrace, Void Staff, Mejai's Soulstealer, Ionian Boots of Lucidity, Oblivion Orb, Farsight Alteration",8,5933,9354,14,0,11,16898,17,0,11,22,11,5,2,0,0,0,0,0,1,0,221,1651,827,118,36,15,3
EUW1_7283149792,1899,CLASSIC,15.2.652.1536,Blue,Blue,4114,Sejuani,Desconocido (Desconocido),"4, 11",7/5/15,27423,58312,12106,"Warden's Mail, Heartsteel, Desconocido, Mercury's Treads, Ruby Crystal, Desconocido, Oracle Lens",3,883,26695,15,1,7,14388,15,0,11,5,7,5,1,0,0,0,1,0,0,1,26,15580,331,175,32,10,3
EUW1_7283149792,1899,CLASSIC,15.2.652.1536,Blue,Blue,pump the menace,Jayce,Desconocido (Desconocido),"12, 4",3/8/10,24836,22779,13599,"Serylda's Grudge, Eclipse, Muramana, Ionian Boots of Lucidity, Pickaxe, Long Sword, Farsight Alteration",2,8888,14261,10,0,3,16618,17,0,1,7,3,8,0,0,0,0,0,2,4,0,215,1636,138,251,36,13,3
EUW1_7283149792,1899,CLASSIC,15.2.652.1536,Blue,Blue,sebbylul,Jhin,Desconocido (Desconocido),"4, 21",11/8/12,30247,28393,14575,"Boots of Swiftness, Rapid Firecannon, The Collector, Doran's Blade, Infinity Edge, Last Whisper, Farsight Alteration",5,7447,20373,12,0,11,16392,16,0,3,2,11,8,1,0,0,0,0,0,3,0,209,6076,195,194,21,9,3
EUW1_7283149792,1899,CLASSIC,15.2.652.1536,Blue,Blue,head empty,Nami,Desconocido (Desconocido),"7, 4",2/5/26,13948,19411,9552,"Desconocido, Forbidden Idol, Ionian Boots of Lucidity, Moonstone Renewer, Fiendish Codex, Imperial Mandate, Oracle Lens",0,2719,4347,26,0,2,13398,15,0,0,8,2,5,0,0,0,0,0,0,1,0,20,23221,283,110,70,41,3
EUW1_7283149792,1899,CLASSIC,15.2.652.1536,Blue,Red,SadlyIneverwin,Cassiopeia,Desconocido (Desconocido),"4, 12",5/6/6,28904,40703,11572,"Liandry's Anguish, Rod of Ages, Seraph's Embrace, Rylai's Crystal Scepter, Desconocido, Desconocido, Farsight Alteration",3,3080,25482,6,0,5,16180,16,0,0,3,5,6,1,0,0,0,2,0,3,0,207,12430,551,247,19,11,5
EUW1_7283149792,1899,CLASSIC,15.2.652.1536,Blue,Red,Morello Salesman,RekSai,Desconocido (Desconocido),"4, 11",3/5/13,20864,51284,11731,"Black Cleaver, Mercury's Treads, Death's Dance, Stridebreaker, Null-Magic Mantle, Desconocido, Oracle Lens",3,55,29156,13,0,3,16289,16,1,24,15,3,5,0,0,0,0,2,0,0,0,31,32703,396,133,31,1,5
EUW1_7283149792,1899,CLASSIC,15.2.652.1536,Blue,Red,Twelve Mid Acc,Sylas,Desconocido (Desconocido),"4, 12",8/8/7,21584,41525,12921,"Riftmaker, Hextech Rocketbelt, Broken Stopwatch, Dark Seal, Mercury's Treads, Cosmic Drive, Oracle Lens",2,9434,10646,7,0,8,14188,15,0,3,4,8,8,0,0,0,0,0,0,3,0,147,8461,345,239,18,3,6
EUW1_7283149792,1899,CLASSIC,15.2.652.1536,Blue,Red,dont click back,Draven,Desconocido (Desconocido),"4, 1",13/9/6,47285,32482,18395,"Bloodthirster, The Collector, Desconocido, Infinity Edge, Noonquiver, Boots of Swiftness, Farsight Alteration",4,4767,18747,6,0,13,14474,15,0,0,1,13,9,2,1,0,0,0,0,0,0,235,8423,95,255,17,9,3
EUW1_7283149792,1899,CLASSIC,15.2.652.1536,Blue,Red,,Janna,Desconocido (Desconocido),"7, 4",2/6/19,10375,26546,8700,"Redemption, Forbidden Idol, Desconocido, Moonstone Renewer, Boots of Swiftness, Blasting Wand, Oracle Lens",0,1718,2806,19,0,2,10398,13,0,8,1,2,6,0,0,0,0,0,0,1,0,23,14487,157,150,80,31,9
EUW1_7282893253,1582,CLASSIC,15.2.652.1536,Blue,Blue,papi oscar,KSante,Desconocido (Desconocido),"4, 12",7/4/10,16085,33633,10923,"Doran's Shield, Desconocido, Spirit Visage, Plated Steelcaps, Negatron Cloak, Ruby Crystal, Oracle Lens",3,7316,10459,10,0,7,14076,15,0,2,0,7,4,0,0,0,0,0,0,1,0,161,8732,385,132,9,5,0
EUW1_7282893253,1582,CLASSIC,15.2.652.1536,Blue,Blue,jenxas,Skarner,Desconocido (Desconocido),"11, 4",9/3/13,21441,32739,10933,"Desconocido, Heartsteel, Desconocido, Cloth Armor, Cloth Armor, Desconocido, Oracle Lens",3,3647,34923,13,0,9,12253,14,0,5,2,9,3,1,0,0,0,2,2,1,0,16,15555,600,84,24,6,3
EUW1_7282893253,1582,CLASSIC,15.2.652.1536,Blue,Blue,VJBYYTF0AO,Viktor,Desconocido (Desconocido),"4, 12",6/5/4,25381,16474,12549,"Rabadon's Deathcap, Desconocido, Liandry's Anguish, Ionian Boots of Lucidity, Doran's Ring, Dark Seal, Farsight Alteration",4,9261,13467,4,0,6,16077,16,0,1,8,6,5,0,0,0,0,0,0,4,0,215,1774,782,137,26,15,1
