Match ID,Duración (s),Modo de juego,Parche,Equipo Ganador,Equipo,Invocador,Campeón,Runas,Hechizos,K/D/A,Daño total,Daño recibido,Oro acumulado,Objetos,Racha Asesinatos,Daño a Torres,Daño a Dragones/Barones,Asistencias,Barón Kills,Nivel de recompensa,Experiencia,Nivel,Pings - All In,Pings - Assist Me,Pings - Enemy Missing,Kills,Deaths,Double Kills,Triple Kills,Quadra Kills,Penta Kills,Dragon Kills,Inhibitor Kills,Torre Destruida,Nexus Kills,Total Minions,Total Heal,Total CC,Total Time Dead,Vision Score,Wards Puestos,Wards Destruidos
LA2_1472049540,1935,CLASSIC,14.24.644.2327,Blue,Red,Genzui,Warwick,Desconocido (Desconocido),"21, 4",12/7/5,34046,46069,13016,"Stridebreaker, Blade of The Ruined King, Doran's Blade, Plated Steelcaps, Sterak's Gage, Kindlegem, Farsight Alteration",5,5303,16729,5,0,12,13075,15,0,0,1,12,7,2,0,0,0,0,0,2,0,170,21347,316,296,16,10,2
LA2_1472049540,1935,CLASSIC,14.24.644.2327,Blue,Red,YESHONEY,Vi,Desconocido (Desconocido),"4, 11",0/5/11,9311,31165,10478,"Mercury's Treads, Desconocido, Control Ward, Black Cleaver, Warden's Mail, Glacial Buckler, Oracle Lens",0,474,21373,11,0,0,12553,14,0,1,1,0,5,0,0,0,0,3,0,0,0,30,14594,285,181,37,8,4
LA2_1472049540,1935,CLASSIC,14.24.644.2327,Blue,Red,Shalnark2332,Katarina,Desconocido (Desconocido),"14, 4",14/6/7,28966,23545,13824,"Oblivion Orb, Lich Bane, Control Ward, Sorcerer's Shoes, Shadowflame, Void Staff, Oracle Lens",6,0,4163,7,0,14,15079,16,0,1,13,14,6,2,1,0,0,0,0,0,0,165,4337,28,153,42,13,9
LA2_1472049540,1935,CLASSIC,14.24.644.2327,Blue,Red,Naxeron,Jhin,Desconocido (Desconocido),"4, 21",6/4/12,22035,22016,14581,"Doran's Blade, The Collector, Boots of Swiftness, Infinity Edge, Rapid Firecannon, Lord Dominik's Regards, Farsight Alteration",2,12029,25128,12,0,6,13926,15,0,0,0,6,4,0,0,0,0,1,0,3,0,220,8982,192,76,30,11,2
LA2_1472049540,1935,CLASSIC,14.24.644.2327,Blue,Red,Thelar,TahmKench,Desconocido (Desconocido),"4, 3",3/7/17,18220,60545,9184,"Negatron Cloak, Desconocido, Control Ward, Dead Man's Plate, Warmog's Armor, Desconocido, Oracle Lens",0,1563,6440,17,0,3,9326,12,0,0,0,3,7,0,0,0,0,0,0,0,0,34,13814,239,211,73,26,6
