Match ID,Duración (s),Modo de juego,Parche,Equipo Ganador,Equipo,Invocador,Campeón,Runas,Hechizos,K/D/A,Daño total,Daño recibido,Oro acumulado,Objetos,Racha Asesinatos,Daño a Torres,Daño a Dragones/Barones,Asistencias,Barón Kills,Nivel de recompensa,Experiencia,Nivel,Pings - All In,Pings - Assist Me,Pings - Enemy Missing,Kills,Deaths,Double Kills,Triple Kills,Quadra Kills,Penta Kills,Dragon Kills,Inhibitor Kills,Torre Destruida,Nexus Kills,Total Minions,Total Heal,Total CC,Total Time Dead,Vision Score,Wards Puestos,Wards Destruidos
EUW1_7279999286,1741,CLASSIC,15.2.652.1536,Red,Blue,Kaisa Wilhelm lI,Sivir,Desconocido (Desconocido),"4, 7",6/5/8,24093,20447,12908,"Essence Reaver, Infinity Edge, Navori Quickblades, Executioner's Calling, Doran's Blade, Berserker's Greaves, Farsight Alteration",2,5358,10738,8,0,6,13657,15,0,2,1,6,5,1,0,0,0,0,0,2,0,251,5285,39,158,11,8,0
EUW1_7279999286,1741,CLASSIC,15.2.652.1536,Red,Blue,Phönlx,Thresh,Desconocido (Desconocido),"14, 4",0/4/20,10506,21878,7347,"Desconocido, Locket of the Iron Solari, Control Ward, Plated Steelcaps, Zeke's Convergence, Cloth Armor, Oracle Lens",0,808,2505,20,0,0,8970,12,1,6,8,0,4,0,0,0,0,0,0,0,0,26,2462,135,136,75,35,6
EUW1_7279999286,1741,CLASSIC,15.2.652.1536,Red,Red,EL EKOINOMISTA,Gwen,Desconocido (Desconocido),"6, 12",7/3/3,21187,23334,14746,"Rabadon's Deathcap, Broken Stopwatch, Ionian Boots of Lucidity, Nashor's Tooth, Riftmaker, Doran's Ring, Stealth Ward",4,16323,30430,3,0,7,17599,17,0,4,3,7,3,1,1,0,0,1,1,5,0,251,5825,149,78,17,9,1
EUW1_7279999286,1741,CLASSIC,15.2.652.1536,Red,Red,prfct,MonkeyKing,Desconocido (Desconocido),"4, 11",12/6/10,20582,42548,13796,"Desconocido, Trinity Force, Desconocido, Black Cleaver, Long Sword, Long Sword, Oracle Lens",3,2286,21040,10,1,12,14328,15,2,15,10,12,6,2,0,0,0,3,0,0,0,19,17193,270,197,14,3,5
EUW1_7279999286,1741,CLASSIC,15.2.652.1536,Red,Red,BURR0S,Zed,Desconocido (Desconocido),"12, 4",4/13/13,26882,32102,10424,"Eclipse, Desconocido, Serylda's Grudge, Ionian Boots of Lucidity, Desconocido, Desconocido, Oracle Lens",0,2135,2135,13,0,4,12434,14,0,0,0,4,13,0,0,0,0,0,0,1,0,136,2358,124,430,13,6,1
EUW1_7279999286,1741,CLASSIC,15.2.652.1536,Red,Red,harmonysjz,MissFortune,Desconocido (Desconocido),"4, 21",5/5/10,31375,21359,15121,"Doran's Blade, Bloodthirster, Essence Reaver, B. F. Sword, Boots of Swiftness, Lord Dominik's Regards, Stealth Ward",2,6366,7171,10,0,5,16975,17,0,1,0,5,5,0,0,0,0,0,0,3,0,268,9635,139,165,14,8,1
EUW1_7279999286,1741,CLASSIC,15.2.652.1536,Red,Red,Rufyat,Poppy,Desconocido (Desconocido),"4, 14",5/8/11,13444,28494,9594,"Boots of Swiftness, Locket of the Iron Solari, Dead Man's Plate, Desconocido, Control Ward, Kindlegem, Oracle Lens",0,1136,1174,11,0,5,9681,12,1,0,5,5,8,0,0,0,0,0,0,0,1,30,3518,189,162,59,20,7
EUW1_7279959546,1210,CLASSIC,15.2.652.1536,Red,Blue,Mertan,Fiora,Desconocido (Desconocido),"12, 4",5/5/3,21561,26769,8194,"Trinity Force, Ravenous Hydra, Boots, Doran's Blade, Long Sword, Desconocido, Stealth Ward",3,2497,4801,3,0,5,10037,13,0,0,2,5,5,0,0,0,0,0,0,1,0,151,13882,91,133,11,5,2
EUW1_7279959546,1210,CLASSIC,15.2.652.1536,Red,Blue,SEQ Keistee,Pantheon,Desconocido (Desconocido),"11, 4",3/7/3,7026,27116,6530,"Gustwalker Hatchling, Desconocido, Boots, Pickaxe, Phage, Desconocido, Stealth Ward",0,0,12923,3,0,3,6505,10,0,0,0,3,7,0,0,0,0,0,0,0,0,2,10370,108,142,15,6,0
EUW1_7279959546,1210,CLASSIC,15.2.652.1536,Red,Blue,RdX PranNEO,Lux,Desconocido (Desconocido),"4, 12",3/5/3,10772,11906,7538,"Doran's Ring, Control Ward, Sorcerer's Shoes, Desconocido, Horizon Focus, Desconocido, Farsight Alteration",2,199,1226,3,0,3,9203,12,0,0,1,3,5,0,0,0,0,0,0,0,0,156,454,300,113,15,9,1
EUW1_7279959546,1210,CLASSIC,15.2.652.1536,Red,Blue,Ken Bolka,Ezreal,Desconocido (Desconocido),"12, 4",1/9/5,16554,20670,6741,"Trinity Force, Tear of the Goddess, Boots, Doran's Blade, Caulfield's Warhammer, Long Sword, Stealth Ward",0,858,946,5,0,1,6774,10,0,0,3,1,9,0,0,0,0,0,0,0,0,133,2504,22,211,7,3,1
EUW1_7279959546,1210,CLASSIC,15.2.652.1536,Red,Blue,Madella,Lulu,Desconocido (Desconocido),"4, 7",2/5/5,5918,12616,5230,"Desconocido, Shurelya's Battlesong, Ionian Boots of Lucidity, Control Ward, Kindlegem, Desconocido, Oracle Lens",0,322,368,5,0,2,5892,9,0,0,3,2,5,0,0,0,0,0,0,0,0,19,1820,210,97,38,17,4
EUW1_7279959546,1210,CLASSIC,15.2.652.1536,Red,Red,Tojî,Sion,Desconocido (Desconocido),"4, 12",3/4/7,13585,27979,8395,"Desconocido, Heartsteel, Plated Steelcaps, Desconocido, Desconocido, Desconocido, Stealth Ward",3,5359,5359,7,0,3,11225,13,0,1,4,3,4,0,0,0,0,0,0,2,0,131,8877,509,44,10,6,1
EUW1_7279959546,1210,CLASSIC,15.2.652.1536,Red,Red,,Talon,Desconocido (Desconocido),"14, 11",9/2/7,16772,23205,10972,"Boots of Swiftness, Youmuu's Ghostblade, Eclipse, Pickaxe, Desconocido, Desconocido, Oracle Lens",4,4262,31232,7,0,9,10840,13,0,0,3,9,2,1,0,0,0,2,1,3,0,40,12627,298,42,15,3,4
EUW1_7279959546,1210,CLASSIC,15.2.652.1536,Red,Red,EL EKOINOMISTA,Mel,Desconocido (Desconocido),"4, 12",6/1/4,12814,7009,8765,"Doran's Ring, Luden's Tempest, Shadowflame, Sorcerer's Shoes, Desconocido, Desconocido, Farsight Alteration",6,2841,5543,4,0,6,11412,13,0,0,7,6,1,1,0,0,0,0,0,0,0,167,995,263,25,12,6,0
EUW1_7279959546,1210,CLASSIC,15.2.652.1536,Red,Red,GTTO Shinorii,Jinx,Desconocido (Desconocido),"4, 21",9/2/9,27790,15527,11242,"Doran's Blade, Long Sword, Berserker's Greaves, Desconocido, Infinity Edge, Desconocido, Farsight Alteration",4,12601,12851,9,0,9,10109,13,1,1,0,9,2,2,1,0,0,0,0,2,1,163,6320,88,51,11,6,3
EUW1_7279959546,1210,CLASSIC,15.2.652.1536,Red,Red,GoddessSeraphine,Janna,Desconocido (Desconocido),"4, 7",4/5/18,8836,14208,7585,"Desconocido, Desconocido, Shurelya's Battlesong, Imperial Mandate, Amplifying Tome, Desconocido, Oracle Lens",2,1941,2947,18,0,4,7654,11,0,0,3,4,5,0,0,0,0,0,0,1,0,18,9671,138,79,51,19,7
EUW1_7279879284,1839,CLASSIC,15.2.652.1536,Red,Blue,Herbys,Illaoi,Desconocido (Desconocido),"12, 4",6/7/7,35821,53890,12669,"Randuin's Omen, Black Cleaver, Iceborn Gauntlet, Spirit Visage, Long Sword, Ruby Crystal, Stealth Ward",4,5631,5776,7,0,6,15316,16,1,4,5,6,7,0,0,0,0,0,0,2,0,225,16045,1022,230,18,10,1
EUW1_7279879284,1839,CLASSIC,15.2.652.1536,Red,Blue,htlzjj,Viego,Desconocido (Desconocido),"11, 4",6/10/5,18055,46766,12466,"Kraken Slayer, Titanic Hydra, Mercury's Treads, Sterak's Gage, Caulfield's Warhammer, Desconocido, Oracle Lens",4,594,15678,5,0,6,12557,14,0,9,0,6,10,2,0,0,0,0,0,0,0,19,15969,193,320,24,2,3
EUW1_7279879284,1839,CLASSIC,15.2.652.1536,Red,Blue,EL EKOINOMISTA,Hwei,Desconocido (Desconocido),"4, 12",4/8/7,36303,29857,10019,"Blighting Jewel, Liandry's Anguish, Desconocido, Sorcerer's Shoes, Desconocido, Dark Seal, Farsight Alteration",2,86,2620,7,0,4,13254,15,1,5,3,4,8,1,0,0,0,0,0,0,0,207,963,683,277,19,8,3
EUW1_7279879284,1839,CLASSIC,15.2.652.1536,Red,Blue,Senrak,Jhin,Desconocido (Desconocido),"4, 21",4/6/5,18202,21075,11466,"The Collector, Refillable Potion, Noonquiver, Infinity Edge, Last Whisper, Boots of Swiftness, Farsight Alteration",0,515,9495,5,0,4,13495,15,0,0,2,4,6,0,0,0,0,1,0,0,0,237,2861,257,125,31,15,3
EUW1_7279879284,1839,CLASSIC,15.2.652.1536,Red,Blue,iMooniie,Renata,Desconocido (Desconocido),"7, 4",0/7/14,5304,18456,7007,"Redemption, Desconocido, Locket of the Iron Solari, Control Ward, Ruby Crystal, Ionian Boots of Lucidity, Oracle Lens",0,125,4862,14,0,0,10107,13,0,6,2,0,7,0,0,0,0,0,0,0,0,26,2373,143,159,84,39,12
EUW1_7279879284,1839,CLASSIC,15.2.652.1536,Red,Red,The Legend RL,Chogath,Desconocido (Desconocido),"4, 12",4/8/7,19594,38968,10982,"Dark Seal, Desconocido, Fimbulwinter, Chain Vest, Heartsteel, Boots of Swiftness, Farsight Alteration",2,2862,5971,7,1,4,14415,15,2,7,0,4,8,0,0,0,0,0,1,1,0,174,9233,696,220,18,10,4
EUW1_7279879284,1839,CLASSIC,15.2.652.1536,Red,Red,Chatoka,Skarner,Desconocido (Desconocido),"4, 11",7/3/17,20672,43985,11802,"Desconocido, Heartsteel, Desconocido, Desconocido, Thornmail, Desconocido, Oracle Lens",3,903,32162,17,0,7,14879,16,0,5,0,7,3,1,0,0,0,2,0,0,1,11,18889,608,99,34,4,5
EUW1_7279879284,1839,CLASSIC,15.2.652.1536,Red,Red,Huaachio,Yone,Desconocido (Desconocido),"4, 12",7/2/9,27646,29683,14163,"Infinity Edge, Blade of The Ruined King, Desconocido, Immortal Shieldbow, Desconocido, Desconocido, Farsight Alteration",7,6843,28992,9,0,7,18045,17,1,3,4,7,2,1,0,0,0,0,0,3,0,247,13194,184,71,13,8,3
EUW1_7279879284,1839,CLASSIC,15.2.652.1536,Red,Red,leeSenMontage,Caitlyn,Desconocido (Desconocido),"4, 21",18/3/9,52290,19052,20524,"Bloodthirster, The Collector, Desconocido, Infinity Edge, Lord Dominik's Regards, Rapid Firecannon, Farsight Alteration",12,11184,30403,9,0,18,18752,18,2,2,2,18,3,2,0,0,0,1,1,4,0,241,7234,195,66,31,9,10
EUW1_7279879284,1839,CLASSIC,15.2.652.1536,Red,Red,endax,Lux,Desconocido (Desconocido),"3, 4",2/4/22,19029,12843,10254,"Luden's Tempest, Desconocido, Desconocido, Desconocido, Fiendish Codex, Desconocido, Oracle Lens",0,1480,6789,22,0,2,12819,14,0,5,0,2,4,0,0,0,0,0,0,1,0,49,1026,213,104,85,37,6
EUW1_7278259027,1504,CLASSIC,15.2.650.9216,Blue,Blue,SCHWIBBLI,Chogath,Desconocido (Desconocido),"12, 4",12/5/9,31712,48348,12202,"Chain Vest, Heartsteel, Boots of Swiftness, Desconocido, Thornmail, Giant's Belt, Stealth Ward",8,7719,7719,9,0,12,15310,16,0,6,2,12,5,1,0,0,0,0,0,2,0,175,18062,984,109,12,6,1
EUW1_7278259027,1504,CLASSIC,15.2.650.9216,Blue,Blue,CrαckBøυle,MasterYi,Desconocido (Desconocido),"4, 11",7/5/7,15769,29029,11938,"Blade of The Ruined King, Plated Steelcaps, Guinsoo's Rageblade, Recurve Bow, Negatron Cloak, Desconocido, Stealth Ward",3,4014,37735,7,0,7,15254,16,0,1,13,7,5,1,0,0,0,2,1,3,0,39,14457,211,143,18,9,0
EUW1_7278259027,1504,CLASSIC,15.2.650.9216,Blue,Blue,FartyPow99,Fizz,Desconocido (Desconocido),"14, 4",11/0/5,18909,18599,13035,"Doran's Ring, Zhonya's Hourglass, Needlessly Large Rod, Mejai's Soulstealer, Ionian Boots of Lucidity, Lich Bane, Stealth Ward",11,8670,9091,5,0,11,15765,16,0,0,4,11,0,1,0,0,0,0,0,4,0,213,3621,185,0,12,8,0
EUW1_7278259027,1504,CLASSIC,15.2.650.9216,Blue,Blue,rodar floating,Ezreal,Desconocido (Desconocido),"21, 4",11/9/8,29319,25176,12556,"Doran's Blade, Muramana, Desconocido, Serylda's Grudge, Trinity Force, Ionian Boots of Lucidity, Farsight Alteration",3,9469,24299,8,0,11,12652,14,1,14,1,11,9,2,0,0,0,0,0,1,1,150,3574,53,205,21,12,3
EUW1_7278259027,1504,CLASSIC,15.2.650.9216,Blue,Blue,Negligible,Nami,Desconocido (Desconocido),"7, 4",1/6/25,10703,15028,7982,"Imperial Mandate, Desconocido, Control Ward, Ionian Boots of Lucidity, Staff of Flowing Water, Bandleglass Mirror, Oracle Lens",0,840,2288,25,0,1,11959,14,0,0,1,1,6,0,0,0,0,0,0,0,0,13,14718,188,99,35,18,0
EUW1_7278259027,1504,CLASSIC,15.2.650.9216,Blue,Red,,Mordekaiser,Desconocido (Desconocido),"4, 14",4/9/1,15890,23436,8059,"Doran's Ring, Mercury's Treads, Rylai's Crystal Scepter, Desconocido, Fiendish Codex, Desconocido, Stealth Ward",2,1815,8955,1,0,4,11161,13,0,0,0,4,9,0,0,0,0,0,0,0,0,126,3436,132,242,11,7,0
EUW1_7278259027,1504,CLASSIC,15.2.650.9216,Blue,Red,Humam0410,Hecarim,Desconocido (Desconocido),"11, 6",12/8/2,33291,39990,11366,"Desconocido, Desconocido, Eclipse, Phage, Pickaxe, Kindlegem, Oracle Lens",6,0,20352,2,0,12,11825,14,0,3,3,12,8,2,0,0,0,1,0,0,0,27,18221,219,289,11,0,3
EUW1_7278259027,1504,CLASSIC,15.2.650.9216,Blue,Red,EL EKOINOMISTA,Hwei,Desconocido (Desconocido),"4, 12",2/6/2,19605,18074,8571,"Desconocido, Zhonya's Hourglass, Desconocido, Doran's Ring, Sorcerer's Shoes, Refillable Potion, Farsight Alteration",2,225,225,2,0,2,12291,14,0,4,9,2,6,0,0,0,0,0,0,0,0,192,605,590,193,13,9,0
EUW1_7278259027,1504,CLASSIC,15.2.650.9216,Blue,Red,Sofos,Draven,Desconocido (Desconocido),"21, 4",4/10/8,26937,24623,10606,"Doran's Blade, Bloodthirster, Berserker's Greaves, Infinity Edge, Last Whisper, Desconocido, Farsight Alteration",2,7103,10038,8,0,4,8620,12,7,2,28,4,10,1,0,0,0,0,0,2,0,157,5659,37,295,13,7,1
EUW1_7278259027,1504,CLASSIC,15.2.650.9216,Blue,Red,HıtThéBéll,Alistar,Desconocido (Desconocido),"4, 14",3/9/13,11195,29786,8356,"Refillable Potion, Desconocido, Zeke's Convergence, Thornmail, Ionian Boots of Lucidity, Kindlegem, Oracle Lens",2,3514,3514,13,0,3,7508,11,1,1,20,3,9,0,0,0,0,0,0,2,0,27,5778,190,236,57,22,3
EUW1_7278239200,952,CLASSIC,15.2.650.9216,Blue,Blue,Kozlando,Cassiopeia,Desconocido (Desconocido),"4, 12",5/2/0,8873,8727,6868,"Doran's Ring, Seraph's Embrace, Blasting Wand, Catalyst of Aeons, Desconocido, Desconocido, Stealth Ward",3,3476,6512,0,0,5,8925,12,0,0,0,5,2,0,0,0,0,0,0,1,0,107,1812,179,45,5,5,0
EUW1_7278239200,952,CLASSIC,15.2.650.9216,Blue,Blue,OPG Teenenjoyer,Kayn,Desconocido (Desconocido),"4, 11",2/0/4,5437,17818,6055,"Desconocido, Eclipse, Ionian Boots of Lucidity, Desconocido, Desconocido, Desconocido, Oracle Lens",2,0,22160,4,0,2,7284,10,0,0,1,2,0,0,0,0,0,2,0,0,0,9,12797,199,0,15,5,1
EUW1_7278239200,952,CLASSIC,15.2.650.9216,Blue,Blue,Baked Mid player,Zed,Desconocido (Desconocido),"4, 12",2/0/5,5708,5617,6022,"Doran's Shield, Refillable Potion, Desconocido, Ionian Boots of Lucidity, Serrated Dirk, Control Ward, Oracle Lens",2,2292,3789,5,0,2,8596,12,0,2,13,2,0,0,0,0,0,0,0,1,0,127,847,29,0,7,6,0
EUW1_7278239200,952,CLASSIC,15.2.650.9216,Blue,Blue,AutomateDeFécule,Twitch,Desconocido (Desconocido),"21, 4",7/0/2,9891,5157,7161,"The Collector, Berserker's Greaves, Pickaxe, B. F. Sword, Desconocido, Doran's Blade, Farsight Alteration",7,1417,3083,2,0,7,6569,10,0,0,0,7,0,2,0,0,0,0,0,0,0,106,1822,141,0,3,2,0
EUW1_7278239200,952,CLASSIC,15.2.650.9216,Blue,Blue,Ti Shady,Lulu,Desconocido (Desconocido),"4, 7",0/2/5,3850,4787,4135,"Desconocido, Control Ward, Ionian Boots of Lucidity, Ardent Censer, Desconocido, Desconocido, Oracle Lens",0,1549,4872,5,0,0,3690,7,0,5,3,0,2,0,0,0,0,0,0,0,0,9,921,92,32,31,15,3
EUW1_7278239200,952,CLASSIC,15.2.650.9216,Blue,Red,,Irelia,Desconocido (Desconocido),"4, 12",1/4/1,5939,12665,5573,"Doran's Shield, Blade of The Ruined King, Boots, Winged Moonplate, Desconocido, Desconocido, Stealth Ward",0,2294,2294,1,0,1,7385,11,0,0,1,1,4,0,0,0,0,0,0,0,0,134,2443,59,76,6,5,0
EUW1_7278239200,952,CLASSIC,15.2.650.9216,Blue,Red,THIS is JINN,Belveth,Desconocido (Desconocido),"11, 4",3/2/1,3952,11977,5710,"Tiamat, Control Ward, Boots, Gustwalker Hatchling, Long Sword, Kraken Slayer, Oracle Lens",2,0,4341,1,0,3,5459,9,6,3,10,3,2,0,0,0,0,0,0,0,0,10,7038,231,44,18,4,4
EUW1_7278239200,952,CLASSIC,15.2.650.9216,Blue,Red,EL EKOINOMISTA,Hwei,Desconocido (Desconocido),"4, 3",0/3/0,5340,6314,4806,"Refillable Potion, Broken Stopwatch, Needlessly Large Rod, Boots, Tear of the Goddess, Doran's Ring, Farsight Alteration",0,941,941,0,0,0,7208,10,0,4,10,0,3,0,0,0,0,0,0,0,0,129,100,302,69,14,5,3
EUW1_7278239200,952,CLASSIC,15.2.650.9216,Blue,Red,LittleBoyWantWin,Varus,Desconocido (Desconocido),"4, 21",0/3/2,4386,6846,4859,"Doran's Blade, Pickaxe, Cull, Boots of Swiftness, Recurve Bow, Amplifying Tome, Stealth Ward",0,0,0,2,0,0,5385,9,0,0,8,0,3,0,0,0,0,0,0,0,0,117,719,65,66,7,5,1
EUW1_7278239200,952,CLASSIC,15.2.650.9216,Blue,Red,BlackSanta98,Alistar,Desconocido (Desconocido),"4, 14",0/4/2,2491,9809,3458,"Desconocido, Boots, Locket of the Iron Solari, Desconocido, Desconocido, Control Ward, Oracle Lens",0,0,0,2,0,0,3985,7,0,3,0,0,4,0,0,0,0,0,0,0,0,16,1510,36,72,23,12,1
EUW1_7278204424,2062,CLASSIC,15.2.650.9216,Blue,Blue,NMTT AlTruGarra,Katarina,Desconocido (Desconocido),"4, 14",12/7/6,24887,31089,13583,"Dark Seal, Zhonya's Hourglass, Desconocido, Lich Bane, Shadowflame, Needlessly Large Rod, Stealth Ward",7,1744,1744,6,0,12,17401,17,0,10,11,12,7,1,0,0,0,0,1,2,0,162,8054,29,178,17,10,1
EUW1_7278204424,2062,CLASSIC,15.2.650.9216,Blue,Blue,ArchDeo,LeeSin,Desconocido (Desconocido),"11, 4",8/8/10,14366,56001,12999,"Control Ward, Eclipse, Desconocido, Desconocido, Black Cleaver, Desconocido, Stealth Ward",2,1788,54550,10,2,8,16951,17,0,0,2,8,8,1,0,0,0,4,0,1,1,16,31710,384,264,35,14,3
EUW1_7278204424,2062,CLASSIC,15.2.650.9216,Blue,Blue,Orochibabtou,Akshan,Desconocido (Desconocido),"4, 14",14/4/12,34976,21063,18348,"Berserker's Greaves, Randuin's Omen, The Collector, Infinity Edge, Guardian Angel, Lord Dominik's Regards, Stealth Ward",6,9165,32653,12,0,14,19746,18,0,1,10,14,4,1,0,0,0,0,0,3,0,212,7144,30,118,28,11,7
EUW1_7278204424,2062,CLASSIC,15.2.650.9216,Blue,Blue,ROz Barjo,Ezreal,Desconocido (Desconocido),"4, 21",9/6/12,32723,29946,16170,"Serylda's Grudge, Trinity Force, Muramana, Desconocido, Spear Of Shojin, Long Sword, Stealth Ward",4,7511,22791,12,0,9,18351,17,0,2,3,9,6,1,0,0,0,0,0,3,0,215,8843,177,116,26,9,7
EUW1_7278204424,2062,CLASSIC,15.2.650.9216,Blue,Blue,THC Beastmode,Xerath,Desconocido (Desconocido),"4, 7",8/5/22,37912,22700,14450,"Desconocido, Rabadon's Deathcap, Horizon Focus, Desconocido, Hextech Alternator, Luden's Tempest, Oracle Lens",4,3801,11979,22,0,8,17047,17,0,4,1,8,5,0,0,0,0,0,0,0,0,73,7542,127,84,52,29,5
EUW1_7278204424,2062,CLASSIC,15.2.650.9216,Blue,Red,fasder back72,Quinn,Desconocido (Desconocido),"4, 14",9/6/5,27987,25062,16337,"Desconocido, The Collector, Edge of Night, Desconocido, Infinity Edge, Pickaxe, Stealth Ward",4,4863,4863,5,0,9,19022,18,0,10,14,9,6,1,0,0,0,0,0,2,0,259,2410,141,227,26,15,0
EUW1_7278204424,2062,CLASSIC,15.2.650.9216,Blue,Red,TheExtracter,Qiyana,Desconocido (Desconocido),"4, 11",8/12/4,24091,42573,13465,"Serpent's Fang, Ionian Boots of Lucidity, Desconocido, Caulfield's Warhammer, Last Whisper, Youmuu's Ghostblade, Oracle Lens",3,0,18341,4,0,8,14205,15,0,3,1,8,12,1,0,0,0,0,0,1,0,34,12123,274,330,29,5,7
EUW1_7278204424,2062,CLASSIC,15.2.650.9216,Blue,Red,EL EKOINOMISTA,Hwei,Desconocido (Desconocido),"4, 12",4/13/6,20761,31748,10959,"Needlessly Large Rod, Zhonya's Hourglass, Hextech Alternator, Sorcerer's Shoes, Desconocido, Doran's Ring, Farsight Alteration",0,1169,1623,6,0,4,13655,15,0,6,5,4,13,0,0,0,0,0,0,0,0,170,1044,619,417,21,12,1
EUW1_7278204424,2062,CLASSIC,15.2.650.9216,Blue,Red,liudvikas,Corki,Desconocido (Desconocido),"21, 4",7/11/7,19587,34897,13177,"Muramana, Trinity Force, Lord Dominik's Regards, Plated Steelcaps, Zeal, Desconocido, Farsight Alteration",3,3075,4681,7,0,7,12942,14,0,1,0,7,11,1,0,0,0,0,0,2,0,231,2122,3,338,10,8,2
EUW1_7278204424,2062,CLASSIC,15.2.650.9216,Blue,Red,wHX,Senna,Desconocido (Desconocido),"7, 4",2/9/16,15589,34653,9983,"Desconocido, Boots of Swiftness, Black Cleaver, Rapid Firecannon, Serrated Dirk, Desconocido, Oracle Lens",2,1445,10174,16,0,2,11961,14,0,0,9,2,9,0,0,0,0,0,0,0,0,36,17026,169,249,58,21,8
EUW1_7274835996,1693,CLASSIC,15.1.649.4112,Red,Blue,V5 Karsa,Vayne,Desconocido (Desconocido),"4, 1",7/7/2,19783,28408,11365,"Wit's End, Trinity Force, Mercury's Treads, Desconocido, Desconocido, Kraken Slayer, Oracle Lens",3,2696,11701,2,0,7,12781,14,0,4,2,7,7,1,0,0,0,0,0,2,0,192,4152,31,211,18,6,5
EUW1_7274835996,1693,CLASSIC,15.1.649.4112,Red,Blue,Shekkon,XinZhao,Desconocido (Desconocido),"4, 11",6/8/5,15540,47255,10154,"Frozen Heart, Desconocido, Phage, Plated Steelcaps, Kindlegem, Pickaxe, Oracle Lens",3,0,11124,5,0,6,11805,14,0,8,3,6,8,1,0,0,0,0,0,0,0,28,23916,576,240,17,4,2
EUW1_7274835996,1693,CLASSIC,15.1.649.4112,Red,Blue,EL EKOINOMISTA,Viktor,Desconocido (Desconocido),"4, 21",3/7/5,26247,26204,10912,"Liandry's Anguish, Broken Stopwatch, Desconocido, Dark Seal, Sorcerer's Shoes, Needlessly Large Rod, Farsight Alteration",0,8922,10289,5,0,3,13476,15,1,2,0,3,7,0,0,0,0,0,0,2,0,203,1356,422,241,23,9,1
EUW1_7274835996,1693,CLASSIC,15.1.649.4112,Red,Blue,v9R Sparta,Twitch,Desconocido (Desconocido),"4, 6",7/9/3,19760,27777,10780,"Desconocido, Hullbreaker, Berserker's Greaves, Guinsoo's Rageblade, Desconocido, Desconocido, Farsight Alteration",4,3976,8608,3,0,7,11195,13,0,0,2,7,9,0,0,0,0,0,0,0,0,178,2603,143,272,12,8,1
EUW1_7274835996,1693,CLASSIC,15.1.649.4112,Red,Blue,fab3000,Lulu,Desconocido (Desconocido),"4, 7",2/4/12,10185,20167,7443,"Moonstone Renewer, Desconocido, Desconocido, Oblivion Orb, Ionian Boots of Lucidity, Ardent Censer, Oracle Lens",2,199,3985,12,0,2,10054,13,1,1,4,2,4,0,0,0,0,0,0,0,0,20,2601,274,131,51,23,3
EUW1_7274835996,1693,CLASSIC,15.1.649.4112,Red,Red,Zbiboo,Teemo,Desconocido (Desconocido),"4, 14",4/4/10,24812,18449,11416,"Doran's Ring, Desconocido, Nashor's Tooth, Dark Seal, Liandry's Anguish, Amplifying Tome, Farsight Alteration",3,5947,21842,10,0,4,16054,16,0,1,6,4,4,0,0,0,0,0,1,1,1,176,3242,606,71,17,8,4
EUW1_7274835996,1693,CLASSIC,15.1.649.4112,Red,Red,Dr Goose,Shyvana,Desconocido (Desconocido),"4, 11",6/3/11,20606,37033,13780,"Plated Steelcaps, Broken Stopwatch, Needlessly Large Rod, Spear Of Shojin, Needlessly Large Rod, Liandry's Anguish, Oracle Lens",5,4462,44091,11,1,6,19132,18,1,7,0,6,3,1,0,0,0,3,2,3,0,34,21992,167,75,30,7,2
EUW1_7274835996,1693,CLASSIC,15.1.649.4112,Red,Red,gujuary,Yone,Desconocido (Desconocido),"4, 14",13/6/5,31351,27448,15651,"Doran's Shield, Blade of The Ruined King, Desconocido, Immortal Shieldbow, Infinity Edge, Frozen Heart, Stealth Ward",4,12280,24565,5,0,13,17392,17,0,7,16,13,6,1,0,0,0,0,0,6,0,210,7240,134,188,12,7,0
EUW1_7274835996,1693,CLASSIC,15.1.649.4112,Red,Red,Colgayte,Karthus,Desconocido (Desconocido),"4, 3",9/5/13,31562,20556,12290,"Desconocido, Zhonya's Hourglass, Desconocido, Shadowflame, Dark Seal, Sorcerer's Shoes, Oracle Lens",7,618,17740,13,0,9,14967,16,1,32,27,9,5,1,1,0,0,0,0,0,0,181,2253,152,117,12,6,1
EUW1_7274835996,1693,CLASSIC,15.1.649.4112,Red,Red,Morenlan,Maokai,Desconocido (Desconocido),"14, 4",3/7/15,12160,28751,9387,"Desconocido, Desconocido, Locket of the Iron Solari, Desconocido, Negatron Cloak, Kindlegem, Oracle Lens",0,1535,6185,15,0,3,11642,14,1,5,7,3,7,0,0,0,0,1,0,1,0,29,6678,246,129,49,22,6
EUW1_7271164377,1882,CLASSIC,15.1.649.4112,Red,Blue,Genouxy,Olaf,Desconocido (Desconocido),"4, 6",4/2/1,13948,28679,11544,"Death's Dance, Stridebreaker, Boots, Doran's Blade, Desconocido, Null-Magic Mantle, Stealth Ward",4,4019,6886,1,0,4,15111,16,0,0,4,4,2,0,0,0,0,0,0,2,0,215,8965,442,55,18,12,1
EUW1_7271164377,1882,CLASSIC,15.1.649.4112,Red,Blue,Casaritav2,Amumu,Desconocido (Desconocido),"4, 11",3/5/12,21597,34851,11164,"Desconocido, Liandry's Anguish, Plated Steelcaps, Frozen Heart, Ruby Crystal, Desconocido, Oracle Lens",2,3099,12451,12,0,3,13107,15,0,2,4,3,5,0,0,0,0,0,0,1,0,23,13374,254,175,15,4,3
EUW1_7271164377,1882,CLASSIC,15.1.649.4112,Red,Blue,RetRoux,Orianna,Desconocido (Desconocido),"4, 12",3/6/5,24133,20456,10531,"Shadowflame, Refillable Potion, Sorcerer's Shoes, Luden's Tempest, Needlessly Large Rod, Needlessly Large Rod, Farsight Alteration",0,0,2357,5,0,3,13815,15,0,8,6,3,6,0,0,0,0,0,0,0,0,213,744,340,143,21,10,4
EUW1_7271164377,1882,CLASSIC,15.1.649.4112,Red,Blue,II Kayron II,MissFortune,Desconocido (Desconocido),"4, 21",4/3/3,14770,16036,13426,"Mortal Reminder, Youmuu's Ghostblade, Boots of Swiftness, Pickaxe, The Collector, B. F. Sword, Farsight Alteration",3,5290,6444,3,0,4,12874,14,3,25,5,4,3,0,0,0,0,0,0,1,0,239,2555,116,59,19,9,3
EUW1_7271164377,1882,CLASSIC,15.1.649.4112,Red,Blue,FranXX,Blitzcrank,Desconocido (Desconocido),"4, 14",1/8/9,5732,17713,7343,"Thornmail, Locket of the Iron Solari, Faerie Charm, Boots of Swiftness, Desconocido, Desconocido, Oracle Lens",0,405,405,9,0,1,7813,11,0,2,18,1,8,0,0,0,0,0,0,0,0,22,997,195,183,72,32,8
EUW1_7271164377,1882,CLASSIC,15.1.649.4112,Red,Red,GòGoPowerRengar,Aatrox,Desconocido (Desconocido),"4, 12",4/5/6,26533,34953,12318,"Doran's Shield, Desconocido, Eclipse, Sterak's Gage, Desconocido, Mercury's Treads, Stealth Ward",2,5651,10937,6,0,4,15714,16,0,3,4,4,5,1,0,0,0,0,1,2,0,194,13881,212,184,14,8,1
EUW1_7271164377,1882,CLASSIC,15.1.649.4112,Red,Red,Noncisononomi,LeeSin,Desconocido (Desconocido),"11, 4",5/3/6,12512,43200,11613,"Eclipse, Desconocido, Control Ward, Desconocido, Phage, Ruby Crystal, Stealth Ward",2,1891,44622,6,1,5,15371,16,0,4,1,5,3,0,0,0,0,3,0,0,0,35,23914,531,82,19,7,5
EUW1_7271164377,1882,CLASSIC,15.1.649.4112,Red,Red,EL EKOINOMISTA,Viktor,Desconocido (Desconocido),"4, 6",7/2/5,35110,22417,15775,"Blighting Jewel, Desconocido, Dark Seal, Rabadon's Deathcap, Desconocido, Liandry's Anguish, Farsight Alteration",6,9018,22611,5,0,7,18588,18,2,29,4,7,2,0,0,0,0,0,0,3,0,257,2706,744,36,19,14,2
EUW1_7271164377,1882,CLASSIC,15.1.649.4112,Red,Red,Anexaa,Jinx,Desconocido (Desconocido),"4, 21",4/3/4,11831,11705,11592,"Doran's Blade, Desconocido, Desconocido, Infinity Edge, Desconocido, Cloak of Agility, Farsight Alteration",3,5901,25824,4,0,4,14197,15,0,1,5,4,3,0,0,0,0,1,1,4,1,190,2217,92,92,28,13,7
EUW1_7271164377,1882,CLASSIC,15.1.649.4112,Red,Red,HÎsoka,Soraka,Desconocido (Desconocido),"4, 7",3/2/10,4735,8662,8565,"Moonstone Renewer, Desconocido, Desconocido, Desconocido, Redemption, Desconocido, Oracle Lens",2,1376,5549,10,0,3,10434,13,0,0,1,3,2,1,0,0,0,0,0,1,0,21,27213,176,49,70,29,4
EUW1_7262374921,965,CLASSIC,15.1.648.3927,Red,Blue,EL EKOINOMISTA,Trundle,Desconocido (Desconocido),"4, 3",5/4/1,8049,14420,7353,"Ravenous Hydra, Refillable Potion, Hullbreaker, Desconocido, Doran's Blade, Boots, Stealth Ward",2,3506,3506,1,0,5,7971,11,0,1,1,5,4,0,0,0,0,0,0,0,0,140,4281,88,71,9,4,3
EUW1_7262374921,965,CLASSIC,15.1.648.3927,Red,Blue,Nylanso,Volibear,Desconocido (Desconocido),"4, 11",1/5/0,3765,18607,5345,"Desconocido, Rod of Ages, Ionian Boots of Lucidity, Cloak of Agility, Desconocido, Desconocido, Oracle Lens",0,34,3830,0,0,1,6865,10,1,0,0,1,5,0,0,0,0,0,0,0,0,10,9652,319,82,3,1,1
EUW1_7262374921,965,CLASSIC,15.1.648.3927,Red,Blue,Chæwön,Ahri,Desconocido (Desconocido),"4, 12",0/1/0,3156,4748,5276,"Doran's Ring, Desconocido, Control Ward, Dark Seal, Ionian Boots of Lucidity, Desconocido, Oracle Lens",0,1094,1094,0,0,0,8016,11,0,1,1,0,1,0,0,0,0,0,0,0,0,140,1104,28,12,8,3,1
EUW1_7262374921,965,CLASSIC,15.1.648.3927,Red,Blue,DrobenCexKing,Draven,Desconocido (Desconocido),"4, 1",0/3/0,1432,4775,4222,"The Collector, Desconocido, Boots, Desconocido, Desconocido, Desconocido, Stealth Ward",0,0,0,0,0,0,5137,9,1,2,2,0,3,0,0,0,0,0,0,0,0,93,318,34,44,7,6,0
