Match ID,Duración (s),Modo de juego,Parche,Equipo Ganador,Equipo,Invocador,Campeón,Runas,Hechizos,K/D/A,Daño total,Daño recibido,Oro acumulado,Objetos,Racha Asesinatos,Daño a Torres,Daño a Dragones/Barones,Asistencias,Barón Kills,Nivel de recompensa,Experiencia,Nivel,Pings - All In,Pings - Assist Me,Pings - Enemy Missing,Kills,Deaths,Double Kills,Triple Kills,Quadra Kills,Penta Kills,Dragon Kills,Inhibitor Kills,Torre Destruida,Nexus Kills,Total Minions,Total Heal,Total CC,Total Time Dead,Vision Score,Wards Puestos,Wards Destruidos
EUW1_7239565063,2268,CLASSIC,14.24.644.2327,Blue,Blue,ShadowmaRe,Braum,Desconocido (Desconocido),"3, 4",2/6/30,13341,33765,11061,"Locket of the Iron Solari, Desconocido, Knight's Vow, Plated Steelcaps, Frozen Heart, Desconocido, Oracle Lens",0,3188,4191,30,0,2,15614,16,8,28,3,2,6,0,0,0,0,0,0,0,0,29,5737,513,226,91,43,7
EUW1_7239565063,2268,CLASSIC,14.24.644.2327,Blue,Red,Ja Morant,Kayle,Desconocido (Desconocido),"4, 12",5/9/11,40297,39538,16865,"Rabadon's Deathcap, Nashor's Tooth, Zhonya's Hourglass, Shadowflame, Boots of Swiftness, Blighting Jewel, Farsight Alteration",2,17426,29228,11,0,5,22016,18,2,5,23,5,9,0,0,0,0,1,4,7,0,306,14563,380,393,23,11,0
EUW1_7239565063,2268,CLASSIC,14.24.644.2327,Blue,Red,Honeyzuka,Vi,Desconocido (Desconocido),"11, 4",5/10/19,14360,47484,13372,"Control Ward, Trinity Force, Frozen Heart, Black Cleaver, Force of Nature, Null-Magic Mantle, Oracle Lens",0,0,15379,19,2,5,17926,17,4,5,14,5,10,0,0,0,0,1,0,0,0,28,12074,527,336,37,7,8
EUW1_7239565063,2268,CLASSIC,14.24.644.2327,Blue,Red,EL EKOINOMISTA,Malphite,Desconocido (Desconocido),"6, 12",8/10/10,31615,31576,14568,"Lich Bane, Zhonya's Hourglass, Desconocido, Desconocido, Ionian Boots of Lucidity, Dark Seal, Oracle Lens",4,4061,5823,10,0,8,16914,17,0,7,6,8,10,2,0,0,0,0,0,1,0,216,2016,859,354,24,4,8
EUW1_7239565063,2268,CLASSIC,14.24.644.2327,Blue,Red,At0ms,Jhin,Desconocido (Desconocido),"4, 1",13/4/11,41219,26502,17880,"The Collector, Boots of Swiftness, Mortal Reminder, Rapid Firecannon, Infinity Edge, B. F. Sword, Stealth Ward",11,5308,19586,11,0,13,17901,17,2,14,7,13,4,2,0,0,0,0,0,1,0,235,2641,236,118,29,11,5
EUW1_7239565063,2268,CLASSIC,14.24.644.2327,Blue,Red,JivanQi,Senna,Desconocido (Desconocido),"7, 4",4/7/24,27318,31474,12388,"Desconocido, Boots of Swiftness, Desconocido, Black Cleaver, Rapid Firecannon, Serrated Dirk, Oracle Lens",2,3194,7306,24,0,4,15314,16,1,2,2,4,7,0,0,0,0,0,0,2,0,33,28649,368,201,61,27,5
EUW1_7239523790,1412,CLASSIC,14.24.644.2327,Red,Blue,KEKGOH,Sett,Desconocido (Desconocido),"4, 12",5/6/0,15585,25041,9656,"Doran's Shield, Stridebreaker, Plated Steelcaps, Sterak's Gage, Long Sword, Long Sword, Stealth Ward",2,3683,3683,0,0,5,10779,13,0,5,0,5,6,0,0,0,0,0,0,1,0,158,1354,191,162,13,8,1
EUW1_7239523790,1412,CLASSIC,14.24.644.2327,Red,Blue,Eodem Caelo,Lillia,Desconocido (Desconocido),"4, 11",2/5/6,8264,31728,8355,"Riftmaker, Liandry's Anguish, Dark Seal, Sorcerer's Shoes, Desconocido, Desconocido, Stealth Ward",0,0,19089,6,0,2,10055,13,2,10,0,2,5,0,0,0,0,0,0,0,0,24,15973,253,170,9,5,0
EUW1_7239523790,1412,CLASSIC,14.24.644.2327,Red,Blue,,Sylas,Desconocido (Desconocido),"12, 4",5/7/7,11673,24374,7558,"Doran's Ring, Hextech Rocketbelt, Sorcerer's Shoes, Desconocido, Aether Wisp, Needlessly Large Rod, Stealth Ward",2,0,4401,7,0,5,9398,12,0,0,1,5,7,0,0,0,0,0,0,0,0,92,3128,209,162,10,5,1
EUW1_7239523790,1412,CLASSIC,14.24.644.2327,Red,Blue,Isillya,Xayah,Desconocido (Desconocido),"21, 4",3/3/1,9427,11568,8767,"Doran's Blade, Essence Reaver, Navori Quickblades, Berserker's Greaves, Pickaxe, Cloak of Agility, Farsight Alteration",3,375,1797,1,0,3,10140,13,1,7,2,3,3,1,0,0,0,0,0,0,0,176,2073,17,47,9,5,1
EUW1_7239523790,1412,CLASSIC,14.24.644.2327,Red,Blue,Basav,Nautilus,Desconocido (Desconocido),"14, 4",1/10/11,9277,23236,6241,"Control Ward, Locket of the Iron Solari, Zeke's Convergence, Desconocido, Desconocido, Desconocido, Oracle Lens",0,0,267,11,0,1,7023,10,2,16,10,1,10,0,0,0,0,0,0,0,0,21,400,207,214,37,13,5
EUW1_7239523790,1412,CLASSIC,14.24.644.2327,Red,Red,wuuwuu,Darius,Desconocido (Desconocido),"4, 12",5/3/10,15848,15648,10460,"Winged Moonplate, Chain Vest, Ruby Crystal, Sterak's Gage, Trinity Force, Plated Steelcaps, Stealth Ward",4,5316,8867,10,0,5,13263,15,1,7,0,5,3,0,0,0,0,0,0,3,0,173,3911,150,48,15,8,1
EUW1_7239523790,1412,CLASSIC,14.24.644.2327,Red,Red,ICEcold Leaf,Briar,Desconocido (Desconocido),"4, 11",14/4/9,24585,32565,12749,"Eclipse, Blade of The Ruined King, Black Cleaver, Desconocido, Desconocido, Mercury's Treads, Oracle Lens",7,631,29149,9,0,14,12343,14,1,8,6,14,4,1,0,0,0,2,0,0,1,20,31073,275,124,17,4,4
EUW1_7239523790,1412,CLASSIC,14.24.644.2327,Red,Red,EL EKOINOMISTA,Viktor,Desconocido (Desconocido),"4, 12",3/6/13,20235,16521,9855,"Liandry's Anguish, Desconocido, Mercury's Treads, Blighting Jewel, Doran's Ring, Amplifying Tome, Farsight Alteration",0,4324,6698,13,0,3,12596,14,0,2,0,3,6,0,0,0,0,0,0,2,0,156,401,188,161,10,8,0
EUW1_7239523790,1412,CLASSIC,14.24.644.2327,Red,Red,BerIow,Ashe,Desconocido (Desconocido),"21, 4",8/2/10,23602,10251,13002,"Doran's Blade, Berserker's Greaves, Kraken Slayer, Phantom Dancer, Bloodthirster, Desconocido, Farsight Alteration",5,10626,23456,10,1,8,11762,14,1,6,3,8,2,0,0,0,0,0,1,3,0,209,2691,669,48,15,5,1
EUW1_7239523790,1412,CLASSIC,14.24.644.2327,Red,Red,Airex,Lulu,Desconocido (Desconocido),"4, 7",1/1/19,5879,8495,7683,"Ionian Boots of Lucidity, Ardent Censer, Desconocido, Moonstone Renewer, Control Ward, Forbidden Idol, Oracle Lens",0,3793,7160,19,0,1,9392,12,0,0,0,1,1,0,0,0,0,1,0,0,0,22,1602,277,25,36,15,2
EUW1_7239478384,1917,CLASSIC,14.24.644.2327,Red,Blue,MagicMuffinXD,Yorick,Desconocido (Desconocido),"4, 12",7/4/2,25342,24336,15032,"Plated Steelcaps, Executioner's Calling, Trinity Force, Serylda's Grudge, Desconocido, Hullbreaker, Stealth Ward",4,11835,20855,2,0,7,17599,17,0,0,5,7,4,1,0,0,0,0,0,2,0,260,8114,221,121,21,11,3
EUW1_7239478384,1917,CLASSIC,14.24.644.2327,Red,Blue,agumon C4 acc,Rengar,Desconocido (Desconocido),"4, 11",4/12/5,17237,48470,11297,"Desconocido, Desconocido, Edge of Night, Serrated Dirk, Desconocido, Boots, Farsight Alteration",0,625,8747,5,0,4,13092,15,1,8,2,4,12,0,0,0,0,0,0,1,0,20,20142,329,368,16,5,3
EUW1_7239478384,1917,CLASSIC,14.24.644.2327,Red,Blue,EL EKOINOMISTA,Orianna,Desconocido (Desconocido),"4, 12",0/5/7,16596,19761,11083,"Seraph's Embrace, Zhonya's Hourglass, Desconocido, Desconocido, Sorcerer's Shoes, Luden's Tempest, Farsight Alteration",0,1753,3571,7,0,0,14578,15,0,3,8,0,5,0,0,0,0,0,0,0,0,254,875,312,189,15,9,1
EUW1_7239478384,1917,CLASSIC,14.24.644.2327,Red,Blue,Winghost,Tristana,Desconocido (Desconocido),"21, 4",3/5/1,14106,22427,11769,"Infinity Edge, The Collector, Berserker's Greaves, Kraken Slayer, Long Sword, Desconocido, Stealth Ward",2,3195,3195,1,0,3,12031,14,0,0,9,3,5,0,0,0,0,0,0,1,0,249,5125,78,195,23,12,4
EUW1_7239478384,1917,CLASSIC,14.24.644.2327,Red,Blue,Fastriker,Lulu,Desconocido (Desconocido),"14, 4",1/5/4,7096,19056,7067,"Boots of Swiftness, Desconocido, Moonstone Renewer, Ardent Censer, Desconocido, Desconocido, Oracle Lens",0,1009,1009,4,0,1,11288,13,0,2,0,1,5,0,0,0,0,0,0,0,0,43,1069,286,176,72,29,10
EUW1_7239478384,1917,CLASSIC,14.24.644.2327,Red,Red,mascarpone69,Fiora,Desconocido (Desconocido),"4, 14",4/5/7,19160,28088,14864,"Death's Dance, Ravenous Hydra, Desconocido, Plated Steelcaps, Trinity Force, Pickaxe, Stealth Ward",0,15530,18345,7,0,4,16960,17,0,0,1,4,5,0,0,0,0,0,0,5,0,245,15628,171,171,12,6,1
EUW1_7239478384,1917,CLASSIC,14.24.644.2327,Red,Red,,Lillia,Desconocido (Desconocido),"11, 4",3/3/18,21065,41375,13305,"Desconocido, Zhonya's Hourglass, Rylai's Crystal Scepter, Ionian Boots of Lucidity, Desconocido, Desconocido, Oracle Lens",2,1543,41958,18,1,3,17964,17,0,2,3,3,3,0,0,0,0,3,0,2,0,54,29955,675,71,25,4,3
EUW1_7239478384,1917,CLASSIC,14.24.644.2327,Red,Red,Ratto Schifoso,Zed,Desconocido (Desconocido),"4, 12",19/1/4,32541,15013,18028,"Eclipse, Serpent's Fang, Ionian Boots of Lucidity, Desconocido, Edge of Night, Serylda's Grudge, Oracle Lens",18,6298,9356,4,0,19,20238,18,0,1,2,19,1,2,0,0,0,0,1,1,1,236,2463,226,25,15,7,0
EUW1_7239478384,1917,CLASSIC,14.24.644.2327,Red,Red,goth asian gf,Jhin,Desconocido (Desconocido),"21, 4",3/2/7,16080,13841,12194,"The Collector, Boots of Swiftness, Infinity Edge, Last Whisper, Doran's Blade, Long Sword, Farsight Alteration",3,2621,16300,7,0,3,14890,16,9,9,59,3,2,0,0,0,0,0,0,2,0,239,4377,250,52,27,11,6
EUW1_7239478384,1917,CLASSIC,14.24.644.2327,Red,Red,Sm1g0l,Poppy,Desconocido (Desconocido),"4, 14",2/4/7,12122,22259,8882,"Plated Steelcaps, Locket of the Iron Solari, Desconocido, Control Ward, Dead Man's Plate, Desconocido, Oracle Lens",0,615,7765,7,0,2,11396,13,0,4,5,2,4,0,0,0,0,1,0,0,0,53,4111,310,105,103,52,6
EUW1_7239440884,1678,CLASSIC,14.24.644.2327,Red,Blue,CupCakeVanilla,Chogath,Desconocido (Desconocido),"4, 12",1/9/5,18394,32348,7553,"Mercury's Treads, Riftmaker, Kindlegem, Doran's Ring, Chain Vest, Ruby Crystal, Farsight Alteration",0,0,373,5,0,1,11014,13,0,3,8,1,9,0,0,0,0,0,0,0,0,147,4793,602,246,13,8,2
EUW1_7239440884,1678,CLASSIC,14.24.644.2327,Red,Blue,N3rot1c,LeeSin,Desconocido (Desconocido),"4, 11",9/7/5,26368,40357,11848,"Plated Steelcaps, Desconocido, Death's Dance, Desconocido, Executioner's Calling, Eclipse, Stealth Ward",3,1120,19072,5,0,9,13379,15,6,0,6,9,7,0,0,0,0,2,0,0,0,19,18404,584,224,26,11,0
EUW1_7239440884,1678,CLASSIC,14.24.644.2327,Red,Blue,xReLeVaNz,Diana,Desconocido (Desconocido),"12, 4",4/7/7,32277,32058,12202,"Liandry's Anguish, Ruby Crystal, Mercury's Treads, Rod of Ages, Null-Magic Mantle, Riftmaker, Farsight Alteration",2,11139,13186,7,0,4,13864,15,1,5,7,4,7,1,0,0,0,0,0,3,0,185,6217,45,220,26,9,1
EUW1_7239440884,1678,CLASSIC,14.24.644.2327,Red,Blue,SERJ TANKlAN,Twitch,Desconocido (Desconocido),"4, 21",8/5/4,27928,22685,12650,"Doran's Blade, Blade of The Ruined King, Runaan's Hurricane, Berserker's Greaves, Infinity Edge, Last Whisper, Farsight Alteration",4,804,10511,4,0,8,12665,14,0,2,7,8,5,1,0,0,0,0,0,0,0,222,7324,290,115,13,7,2
EUW1_7239440884,1678,CLASSIC,14.24.644.2327,Red,Blue,EINS NINJA,Lulu,Desconocido (Desconocido),"7, 4",1/7/13,8226,20997,6935,"Shurelya's Battlesong, Desconocido, Ionian Boots of Lucidity, Ardent Censer, Amplifying Tome, Desconocido, Oracle Lens",0,265,1224,13,0,1,8210,11,1,14,0,1,7,0,0,0,0,0,0,0,0,30,2508,249,186,37,15,2
EUW1_7239440884,1678,CLASSIC,14.24.644.2327,Red,Red,EL EKOINOMISTA,DrMundo,Desconocido (Desconocido),"4, 12",13/3/7,42112,74864,16144,"Titanic Hydra, Spirit Visage, Chain Vest, Boots of Swiftness, Heartsteel, Warmog's Armor, Stealth Ward",10,19354,19630,7,0,13,16855,17,0,3,5,13,3,1,0,0,0,0,1,7,0,204,17832,279,77,15,9,0
EUW1_7239440884,1678,CLASSIC,14.24.644.2327,Red,Red,Zee M0N,Graves,Desconocido (Desconocido),"4, 11",3/7/9,17328,26739,11389,"Plated Steelcaps, The Collector, Lord Dominik's Regards, Youmuu's Ghostblade, Desconocido, Desconocido, Oracle Lens",0,1110,30187,9,0,3,12806,14,0,10,11,3,7,0,0,0,0,0,1,0,1,28,9187,563,191,16,1,6
EUW1_7239440884,1678,CLASSIC,14.24.644.2327,Red,Red,buurtgek,Fizz,Desconocido (Desconocido),"4, 12",9/5/8,21865,23681,11967,"Dark Seal, Luden's Tempest, Ionian Boots of Lucidity, Zhonya's Hourglass, Desconocido, Oblivion Orb, Oracle Lens",3,1462,9095,8,0,9,14116,15,0,4,15,9,5,2,1,0,0,0,0,0,0,166,7568,179,141,9,1,2
EUW1_7239440884,1678,CLASSIC,14.24.644.2327,Red,Red,Prince Floky,Jinx,Desconocido (Desconocido),"4, 21",2/2/17,19520,14334,11892,"Kraken Slayer, Runaan's Hurricane, Lord Dominik's Regards, Doran's Blade, Desconocido, Berserker's Greaves, Farsight Alteration",2,4079,15795,17,1,2,14198,15,1,0,2,2,2,0,0,0,0,1,1,2,0,191,4404,145,71,25,9,3
EUW1_7239440884,1678,CLASSIC,14.24.644.2327,Red,Red,Aholaziregha,Aurora,Desconocido (Desconocido),"4, 14",8/6/10,25788,17710,10829,"Desconocido, Shadowflame, Desconocido, Rabadon's Deathcap, Desconocido, Boots, Oracle Lens",5,3951,6361,10,0,8,11444,14,0,0,0,8,6,1,0,0,0,0,0,1,0,73,3637,178,124,49,27,1
EUW1_7239400691,2130,CLASSIC,14.24.644.2327,Blue,Blue,LeeNeaj,DrMundo,Desconocido (Desconocido),"6, 12",4/8/8,21931,78983,16003,"Warmog's Armor, Boots of Swiftness, Heartsteel, Titanic Hydra, Bramble Vest, Spirit Visage, Oracle Lens",3,15920,27840,8,0,4,19116,18,0,0,2,4,8,0,0,0,0,0,1,6,0,220,15507,330,324,26,7,7
EUW1_7239400691,2130,CLASSIC,14.24.644.2327,Blue,Blue,Knoep3rt,Zac,Desconocido (Desconocido),"11, 4",6/2/15,22016,44567,15896,"Sunfire Aegis, Mercury's Treads, Thornmail, Desconocido, Liandry's Anguish, Warden's Mail, Stealth Ward",5,686,30650,15,1,6,20563,18,1,10,0,6,2,0,0,0,0,1,0,1,0,48,76619,584,73,26,10,2
EUW1_7239400691,2130,CLASSIC,14.24.644.2327,Blue,Blue,XTC,Hwei,Desconocido (Desconocido),"4, 12",8/7/5,24747,27880,14723,"Liandry's Anguish, Zhonya's Hourglass, Needlessly Large Rod, Sorcerer's Shoes, Mejai's Soulstealer, Desconocido, Oracle Lens",7,1982,11561,5,0,8,20251,18,0,1,9,8,7,0,0,0,0,0,0,1,0,253,4972,856,174,32,10,7
EUW1_7239400691,2130,CLASSIC,14.24.644.2327,Blue,Blue,newgen tilda,Draven,Desconocido (Desconocido),"4, 21",15/5/9,39986,23070,19876,"The Collector, Bloodthirster, Infinity Edge, Lord Dominik's Regards, Maw of Malmortius, Berserker's Greaves, Farsight Alteration",5,7230,38816,9,1,15,20166,18,0,2,7,15,5,3,1,0,0,0,1,1,1,244,10112,98,152,14,12,2
EUW1_7239400691,2130,CLASSIC,14.24.644.2327,Blue,Blue,The redeemer2,TahmKench,Desconocido (Desconocido),"14, 4",4/10/13,13038,52957,10197,"Bami's Cinder, Desconocido, Control Ward, Heartsteel, Mercury's Treads, Desconocido, Oracle Lens",2,322,1701,13,0,4,10680,13,1,16,11,4,10,1,0,0,0,0,0,0,0,23,9810,145,257,112,49,9
EUW1_7239400691,2130,CLASSIC,14.24.644.2327,Blue,Red,Thomas is a qt,Quinn,Desconocido (Desconocido),"4, 14",8/8/7,32859,29865,14294,"Desconocido, Kraken Slayer, Berserker's Greaves, Lord Dominik's Regards, Vampiric Scepter, Recurve Bow, Stealth Ward",4,4354,10633,7,0,8,15590,16,0,0,0,8,8,0,0,0,0,1,0,2,0,217,5173,206,294,8,4,0
EUW1_7239400691,2130,CLASSIC,14.24.644.2327,Blue,Red,NewDiamond,Shyvana,Desconocido (Desconocido),"4, 11",8/8/13,54594,50200,16400,"Liandry's Anguish, Nashor's Tooth, Sorcerer's Shoes, Rabadon's Deathcap, Void Staff, Hextech Alternator, Oracle Lens",2,4516,48289,13,0,8,19290,18,0,6,0,8,8,0,0,0,0,3,0,2,0,108,18110,254,228,25,0,10
EUW1_7239400691,2130,CLASSIC,14.24.644.2327,Blue,Red,EL EKOINOMISTA,Viktor,Desconocido (Desconocido),"4, 12",9/7/11,50211,29866,13806,"Void Staff, Desconocido, Liandry's Anguish, Sorcerer's Shoes, Needlessly Large Rod, Needlessly Large Rod, Farsight Alteration",5,789,1493,11,0,9,17389,17,0,12,6,9,7,1,0,0,0,0,0,0,0,254,2211,497,319,18,9,2
EUW1_7239400691,2130,CLASSIC,14.24.644.2327,Blue,Red,rhityn,Aphelios,Desconocido (Desconocido),"4, 21",5/9/10,26716,24401,12427,"Doran's Blade, Desconocido, Runaan's Hurricane, Berserker's Greaves, Mortal Reminder, Pickaxe, Farsight Alteration",3,1330,5210,10,0,5,15308,16,0,0,0,5,9,1,0,0,0,0,0,0,0,240,5124,213,238,34,15,3
EUW1_7239400691,2130,CLASSIC,14.24.644.2327,Blue,Red,XiersNM,Janna,Desconocido (Desconocido),"4, 7",2/6/24,19807,26586,9328,"Desconocido, Moonstone Renewer, Bandleglass Mirror, Oblivion Orb, Boots of Swiftness, Desconocido, Oracle Lens",0,423,1060,24,0,2,12954,14,1,6,19,2,6,0,0,0,0,0,0,0,0,24,14121,272,148,102,44,7
EUW1_7238438793,2062,CLASSIC,14.24.644.2327,Red,Blue,EL EKOINOMISTA,Aurora,Desconocido (Desconocido),"4, 12",12/2/5,45087,34080,18358,"Liandry's Anguish, Zhonya's Hourglass, Desconocido, Cosmic Drive, Rabadon's Deathcap, Sorcerer's Shoes, Farsight Alteration",12,15480,18019,5,0,12,21485,18,0,1,3,12,2,0,0,0,0,0,0,4,0,309,12887,333,59,19,10,2
EUW1_7238438793,2062,CLASSIC,14.24.644.2327,Red,Blue,ANDERTAKER,Skarner,Desconocido (Desconocido),"11, 4",6/2/11,14174,53589,10771,"Sterak's Gage, Heartsteel, Mercury's Treads, Cloth Armor, Negatron Cloak, Spectre's Cowl, Oracle Lens",6,0,29168,11,0,6,13560,15,0,1,0,6,2,0,0,0,0,1,0,0,0,13,23551,522,48,21,2,6
EUW1_7238438793,2062,CLASSIC,14.24.644.2327,Red,Blue,Raylling,Katarina,Desconocido (Desconocido),"4, 14",7/8/10,27622,30627,11712,"Lich Bane, Zhonya's Hourglass, Shadowflame, Desconocido, Sorcerer's Shoes, Desconocido, Farsight Alteration",3,0,3936,10,0,7,14853,16,0,0,2,7,8,0,0,0,0,0,0,0,0,158,3432,39,253,18,11,0
EUW1_7238438793,2062,CLASSIC,14.24.644.2327,Red,Blue,MrChooko,Jinx,Desconocido (Desconocido),"4, 21",12/8/14,30911,28436,15268,"Desconocido, Berserker's Greaves, The Collector, Hexdrinker, Phantom Dancer, Infinity Edge, Farsight Alteration",3,10140,30217,14,1,12,15028,16,0,1,2,12,8,1,0,0,0,1,1,3,0,208,7226,145,190,31,8,5
EUW1_7238438793,2062,CLASSIC,14.24.644.2327,Red,Blue,Nicolas Maduro,Nautilus,Desconocido (Desconocido),"14, 4",2/3/21,15229,29019,9474,"Desconocido, Locket of the Iron Solari, Thornmail, Mercury's Treads, Spectre's Cowl, Negatron Cloak, Oracle Lens",2,509,4938,21,0,2,11816,14,0,1,2,2,3,0,0,0,0,0,0,1,0,27,5365,390,111,76,35,2
EUW1_7238438793,2062,CLASSIC,14.24.644.2327,Red,Red,Niarkados,Trundle,Desconocido (Desconocido),"4, 12",2/5/2,11966,35230,13261,"Hullbreaker, Trinity Force, Null-Magic Mantle, Ruby Crystal, Titanic Hydra, Mercury's Treads, Stealth Ward",2,21453,24729,2,0,2,16251,16,0,0,1,2,5,0,0,0,0,0,2,6,1,205,15303,220,147,18,9,4
EUW1_7238438793,2062,CLASSIC,14.24.644.2327,Red,Red,Chiiibre,Khazix,Desconocido (Desconocido),"4, 11",2/8/2,12272,37018,11032,"Serrated Dirk, Caulfield's Warhammer, Youmuu's Ghostblade, Desconocido, Ionian Boots of Lucidity, Control Ward, Oracle Lens",0,701,25581,2,0,2,13239,15,0,0,0,2,8,0,0,0,0,1,1,0,0,22,17740,186,276,37,9,5
EUW1_7238438793,2062,CLASSIC,14.24.644.2327,Red,Red,MonRenoiDeCombat,Vladimir,Desconocido (Desconocido),"4, 6",13/4/2,54216,53474,19331,"Riftmaker, Mejai's Soulstealer, Cosmic Drive, Rabadon's Deathcap, Boots of Swiftness, Void Staff, Stealth Ward",7,7545,7545,2,0,13,21432,18,1,0,1,13,4,3,1,0,0,0,1,3,0,286,62032,209,163,27,12,6
EUW1_7238438793,2062,CLASSIC,14.24.644.2327,Red,Red, Èngman,Brand,Desconocido (Desconocido),"4, 14",4/12/6,28855,30032,11308,"Doran's Ring, Liandry's Anguish, Sorcerer's Shoes, Rylai's Crystal Scepter, Desconocido, Amplifying Tome, Stealth Ward",0,736,5359,6,0,4,13150,15,0,6,0,4,12,0,0,0,0,1,0,1,0,170,1533,610,318,21,12,2
EUW1_7238438793,2062,CLASSIC,14.24.644.2327,Red,Red,wazzzzzzzap,Xerath,Desconocido (Desconocido),"4, 7",2/10/7,20862,23137,10353,"Desconocido, Luden's Tempest, Rabadon's Deathcap, Sorcerer's Shoes, Hextech Alternator, Desconocido, Oracle Lens",0,0,2690,7,0,2,13265,15,0,0,13,2,10,0,0,0,0,0,0,0,0,85,2020,179,249,50,19,4
EUW1_7238379714,1968,CLASSIC,14.24.644.2327,Blue,Blue,SUCK YOO HOMO,DrMundo,Desconocido (Desconocido),"12, 6",5/4/7,23434,84352,13980,"Heartsteel, Boots of Swiftness, Warmog's Armor, Spirit Visage, Thornmail, Long Sword, Stealth Ward",2,10741,12853,7,0,5,17145,17,1,1,0,5,4,1,0,0,0,0,0,3,0,227,11425,214,154,11,7,1
EUW1_7238379714,1968,CLASSIC,14.24.644.2327,Blue,Blue,xxtarikxx,Graves,Desconocido (Desconocido),"4, 11",4/4/7,13111,28621,12412,"The Collector, Youmuu's Ghostblade, Plated Steelcaps, Black Cleaver, Long Sword, Desconocido, Stealth Ward",2,623,37404,7,1,4,16571,17,0,3,0,4,4,1,0,0,0,3,0,0,0,27,14766,550,97,35,10,7
EUW1_7238379714,1968,CLASSIC,14.24.644.2327,Blue,Blue,SUCK YOO MOM,Smolder,Desconocido (Desconocido),"4, 12",6/4/5,27470,22009,14940,"Bloodthirster, Essence Reaver, Muramana, Ionian Boots of Lucidity, Trinity Force, Desconocido, Stealth Ward",3,8332,22026,5,0,6,16744,17,0,5,9,6,4,1,0,0,0,0,0,4,0,239,5351,455,136,18,10,2
EUW1_7238379714,1968,CLASSIC,14.24.644.2327,Blue,Blue,KOKOchat,Xerath,Desconocido (Desconocido),"4, 12",10/0/9,31307,7790,14886,"Shadowflame, Desconocido, Luden's Tempest, Needlessly Large Rod, Sorcerer's Shoes, Needlessly Large Rod, Stealth Ward",10,4694,9046,9,0,10,15519,16,0,1,0,10,0,1,0,0,0,0,1,2,0,228,1708,219,0,23,10,3
EUW1_7238379714,1968,CLASSIC,14.24.644.2327,Blue,Blue,Hollow Pumpinks,Lux,Desconocido (Desconocido),"4, 14",1/6/16,14568,16280,9426,"Desconocido, Refillable Potion, Luden's Tempest, Sorcerer's Shoes, Desconocido, Amplifying Tome, Oracle Lens",0,215,868,16,0,1,12723,14,4,0,0,1,6,0,0,0,0,0,1,0,1,56,779,266,130,84,30,9
EUW1_7238379714,1968,CLASSIC,14.24.644.2327,Blue,Red,EL EKOINOMISTA,Viktor,Desconocido (Desconocido),"4, 12",1/6/3,42830,26871,11404,"Void Staff, Desconocido, Sorcerer's Shoes, Oblivion Orb, Liandry's Anguish, Desconocido, Farsight Alteration",0,2835,2835,3,0,1,15219,16,0,2,3,1,6,0,0,0,0,0,0,1,0,269,3353,304,176,12,9,0
EUW1_7238379714,1968,CLASSIC,14.24.644.2327,Blue,Red,MrChooko,Vayne,Desconocido (Desconocido),"4, 21",3/7/1,34992,27445,12084,"Doran's Blade, Blade of The Ruined King, Berserker's Greaves, Guinsoo's Rageblade, Wit's End, B. F. Sword, Farsight Alteration",0,6572,6572,1,0,3,12495,14,0,3,3,3,7,0,0,0,0,0,0,3,0,223,10674,108,177,12,7,3
EUW1_7238379714,1968,CLASSIC,14.24.644.2327,Blue,Red,Raylling,Yone,Desconocido (Desconocido),"4, 12",8/4/3,21045,27143,12511,"Berserker's Greaves, Infinity Edge, Immortal Shieldbow, Negatron Cloak, Dagger, Blade of The Ruined King, Farsight Alteration",7,1784,2249,3,0,8,14460,15,1,0,0,8,4,2,0,0,0,1,0,0,0,234,6209,217,129,17,9,1
EUW1_7238379714,1968,CLASSIC,14.24.644.2327,Blue,Red,Nicolas Maduro,Lulu,Desconocido (Desconocido),"14, 4",2/5/7,8271,18723,7540,"Desconocido, Shurelya's Battlesong, Redemption, Forbidden Idol, Ionian Boots of Lucidity, Amplifying Tome, Oracle Lens",0,0,0,7,0,2,11244,13,0,0,5,2,5,0,0,0,0,0,0,0,0,28,4776,311,77,80,37,8
EUW1_7238379714,1968,CLASSIC,14.24.644.2327,Blue,Red,ANDERTAKER,Amumu,Desconocido (Desconocido),"11, 4",4/4/11,18785,36970,11093,"Abyssal Mask, Liandry's Anguish, Mercury's Treads, Thornmail, Desconocido, Desconocido, Oracle Lens",2,340,35551,11,0,4,12645,14,0,0,6,4,4,0,0,0,0,0,0,0,0,18,16744,161,131,29,7,6
EUW1_7238297984,2204,CLASSIC,14.24.644.2327,Blue,Blue,,Ornn,Desconocido (Desconocido),"4, 12",3/6/14,14781,50210,13489,"Chain Vest, Randuin's Omen, Desconocido, Turbo Chemtank, Mercury's Treads, Giant's Belt, Oracle Lens",0,7619,10546,14,1,3,18866,18,0,0,18,3,6,0,0,0,0,0,0,2,1,175,5321,507,254,22,6,3
EUW1_7238297984,2204,CLASSIC,14.24.644.2327,Blue,Blue,HandSome Yi,MasterYi,Desconocido (Desconocido),"11, 4",26/8/10,68636,50624,25362,"Blade of The Ruined King, Titanic Hydra, Wit's End, Guinsoo's Rageblade, Desconocido, Hullbreaker, Oracle Lens",6,6583,69228,10,1,26,25369,18,4,24,12,26,8,4,2,0,0,0,1,2,0,155,23869,324,302,23,5,5
EUW1_7238297984,2204,CLASSIC,14.24.644.2327,Blue,Blue,EL EKOINOMISTA,Viktor,Desconocido (Desconocido),"4, 12",6/12/10,45002,33268,15885,"Liandry's Anguish, Desconocido, Sorcerer's Shoes, Desconocido, Rabadon's Deathcap, Amplifying Tome, Farsight Alteration",2,8597,8597,10,0,6,17177,17,0,3,8,6,12,0,0,0,0,0,0,3,0,224,2299,328,424,13,7,0
EUW1_7238297984,2204,CLASSIC,14.24.644.2327,Blue,Blue,Squinin,Corki,Desconocido (Desconocido),"21, 4",6/11/11,30891,34527,13277,"Doran's Blade, Trinity Force, Desconocido, Mercury's Treads, Mortal Reminder, Muramana, Farsight Alteration",2,5563,8891,11,0,6,14535,15,0,14,13,6,11,0,0,0,0,0,0,2,0,180,4067,24,411,27,13,4
EUW1_7238297984,2204,CLASSIC,14.24.644.2327,Blue,Blue,skainn,Thresh,Desconocido (Desconocido),"4, 14",1/11/25,9704,39779,10371,"Desconocido, Desconocido, Warmog's Armor, Boots of Swiftness, Desconocido, Kindlegem, Oracle Lens",0,51,1968,25,0,1,14810,16,0,10,11,1,11,0,0,0,0,0,0,0,0,14,3391,152,210,118,53,9
EUW1_7238297984,2204,CLASSIC,14.24.644.2327,Blue,Red,Alfredz,Ryze,Desconocido (Desconocido),"12, 4",12/11/12,39797,40537,17147,"Zhonya's Hourglass, Sorcerer's Shoes, Rod of Ages, Frozen Heart, Seraph's Embrace, Rabadon's Deathcap, Farsight Alteration",3,8681,16465,12,0,12,19246,18,5,20,9,12,11,1,0,0,0,0,1,2,0,235,5536,330,369,17,10,2
EUW1_7238297984,2204,CLASSIC,14.24.644.2327,Blue,Red, Fasioti,JarvanIV,Desconocido (Desconocido),"4, 11",9/8/25,23701,41448,14264,"Frozen Heart, Eclipse, Pickaxe, Plated Steelcaps, Spirit Visage, Desconocido, Oracle Lens",5,2099,42509,25,1,9,16557,17,0,10,19,9,8,2,0,0,0,5,0,1,0,23,15639,504,234,31,7,5
EUW1_7238297984,2204,CLASSIC,14.24.644.2327,Blue,Red,Makïma,Kassadin,Desconocido (Desconocido),"12, 4",13/8/15,41794,43296,14971,"Desconocido, Zhonya's Hourglass, Seraph's Embrace, Sorcerer's Shoes, Rabadon's Deathcap, Desconocido, Oracle Lens",7,0,6022,15,0,13,17655,17,0,9,12,13,8,1,0,0,0,0,0,0,0,192,7172,324,215,21,6,5
EUW1_7238297984,2204,CLASSIC,14.24.644.2327,Blue,Red,,Kaisa,Desconocido (Desconocido),"21, 4",10/10/15,39516,31152,16983,"Desconocido, Kraken Slayer, Guinsoo's Rageblade, Guardian Angel, Vampiric Scepter, Berserker's Greaves, Farsight Alteration",5,11407,23756,15,0,10,17700,17,6,11,9,10,10,2,0,0,0,0,0,4,0,212,5053,289,272,20,12,3
EUW1_7238297984,2204,CLASSIC,14.24.644.2327,Blue,Red,CenturionLOL,TahmKench,Desconocido (Desconocido),"14, 4",4/5/28,24001,52683,11194,"Desconocido, Ruby Crystal, Heartsteel, Spirit Visage, Mercury's Treads, Dead Man's Plate, Oracle Lens",2,2296,3757,28,0,4,13778,15,0,3,3,4,5,0,0,0,0,0,2,1,0,21,17989,252,122,94,44,4
EUW1_7238227390,1294,CLASSIC,14.24.644.2327,Blue,Blue,G2JDGGENG,Malphite,Desconocido (Desconocido),"4, 12",5/1/8,21043,15548,10249,"Doran's Ring, Fimbulwinter, Turbo Chemtank, Warden's Mail, Glacial Buckler, Mercury's Treads, Stealth Ward",3,5234,5648,8,0,5,12446,14,0,2,1,5,1,0,0,0,0,0,0,2,0,164,1631,624,25,15,8,0
EUW1_7238227390,1294,CLASSIC,14.24.644.2327,Blue,Blue,HOLD ME,Talon,Desconocido (Desconocido),"11, 14",18/3/5,28005,27159,13620,"Edge of Night, Youmuu's Ghostblade, Desconocido, Boots of Swiftness, Desconocido, Caulfield's Warhammer, Oracle Lens",7,5907,37621,5,0,18,13425,15,2,3,0,18,3,3,1,0,0,1,0,1,0,22,13782,355,107,15,2,2
EUW1_7238227390,1294,CLASSIC,14.24.644.2327,Blue,Blue,lIl Shinyo lIl,Taliyah,Desconocido (Desconocido),"3, 4",2/2/10,13247,8743,9171,"Seraph's Embrace, Sorcerer's Shoes, Luden's Tempest, Needlessly Large Rod, Doran's Ring, Desconocido, Stealth Ward",0,5954,6094,10,0,2,11431,13,0,1,4,2,2,0,0,0,0,0,0,1,0,175,743,423,65,21,10,2
