Match ID,Duración (s),Modo de juego,Parche,Equipo Ganador,Equipo,Invocador,Campeón,Runas,Hechizos,K/D/A,Daño total,Daño recibido,Oro acumulado,Objetos,Racha Asesinatos,Daño a Torres,Daño a Dragones/Barones,Asistencias,Barón Kills,Nivel de recompensa,Experiencia,Nivel,Pings - All In,Pings - Assist Me,Pings - Enemy Missing,Kills,Deaths,Double Kills,Triple Kills,Quadra Kills,Penta Kills,Dragon Kills,Inhibitor Kills,Torre Destruida,Nexus Kills,Total Minions,Total Heal,Total CC,Total Time Dead,Vision Score,Wards Puestos,Wards Destruidos
LA2_1481235803,992,URF,15.2.652.1536,Red,Blue,JinSoül,Ashe,Desconocido (Desconocido),"6, 4",2/7/10,12697,22196,11659,"Berserker's Greaves, Kraken Slayer, Phantom Dancer, Infinity Edge, Desconocido, Desconocido, Stealth Ward",0,537,537,10,0,2,19583,18,0,0,0,2,7,0,0,0,0,0,0,0,0,86,1005,376,178,7,2,0
LA2_1481235803,992,URF,15.2.652.1536,Red,Blue,HugoCL,Ambessa,Desconocido (Desconocido),"4, 6",0/13/6,5443,25314,9483,"Desconocido, Boots, Eclipse, Spear Of Shojin, Desconocido, Pickaxe, Stealth Ward",0,0,6489,6,0,0,16351,16,0,1,0,0,13,0,0,0,0,0,0,0,0,62,1654,110,256,9,6,0
LA2_1481235803,992,URF,15.2.652.1536,Red,Blue,kewec,Nasus,Desconocido (Desconocido),"4, 6",5/9/4,13445,37714,12088,"Spirit Visage, Trinity Force, Frozen Heart, Desconocido, Mercury's Treads, Bramble Vest, Stealth Ward",0,0,0,4,0,5,18380,18,0,0,0,5,9,0,0,0,0,0,0,0,0,95,7401,134,215,4,5,0
LA2_1481235803,992,URF,15.2.652.1536,Red,Red,Thelar,TwistedFate,Desconocido (Desconocido),"4, 3",14/4/9,38886,14757,17181,"Void Staff, Desconocido, Needlessly Large Rod, Lich Bane, Rabadon's Deathcap, Desconocido, Farsight Alteration",8,23847,27323,9,0,14,19974,18,0,0,0,14,4,5,1,0,0,0,3,7,0,116,314,49,118,12,7,0
LA2_1481235803,992,URF,15.2.652.1536,Red,Red,Genzui,Morgana,Desconocido (Desconocido),"14, 4",7/3/14,18655,16590,12215,"Liandry's Anguish, Desconocido, Shadowflame, Sorcerer's Shoes, Needlessly Large Rod, Desconocido, Stealth Ward",3,2018,4223,14,0,7,18398,18,0,0,1,7,3,0,0,0,0,0,0,1,0,53,2201,93,87,12,9,0
LA2_1481235803,992,URF,15.2.652.1536,Red,Red,Izanagı,Syndra,Desconocido (Desconocido),"6, 4",9/3/10,25486,17050,14094,"Desconocido, Shadowflame, Rabadon's Deathcap, Luden's Tempest, Amplifying Tome, Desconocido, Stealth Ward",4,4859,16323,10,0,9,21445,19,0,0,0,9,3,1,0,0,0,0,0,1,0,93,444,450,88,22,16,0
LA2_1481235803,992,URF,15.2.652.1536,Red,Red,SoGGeK1ng,Zed,Desconocido (Desconocido),"14, 4",8/4/10,23357,15267,14378,"Desconocido, Eclipse, Edge of Night, Serylda's Grudge, Long Sword, Long Sword, Stealth Ward",5,5532,15187,10,0,8,18427,18,0,0,0,8,4,0,0,0,0,1,0,2,1,109,695,224,140,5,2,0
LA2_1481235803,992,URF,15.2.652.1536,Red,Red,Naxeron,Poppy,Desconocido (Desconocido),"4, 6",8/5/16,17121,19656,13051,"Dead Man's Plate, Eclipse, Fimbulwinter, Plated Steelcaps, Desconocido, Desconocido, Stealth Ward",5,1706,1706,16,0,8,18799,18,0,0,0,8,5,0,0,0,0,0,0,0,0,48,612,335,137,11,6,0
LA2_1481228662,859,URF,15.2.652.1536,Blue,Blue,Thelar,TwistedFate,Desconocido (Desconocido),"4, 3",8/4/7,20675,13083,13989,"Rabadon's Deathcap, Lich Bane, Banshee's Veil, Desconocido, Desconocido, Boots, Stealth Ward",6,6807,11100,7,0,8,18069,17,0,0,0,8,4,0,0,0,0,0,0,2,0,119,179,51,65,12,9,0
LA2_1481228662,859,URF,15.2.652.1536,Blue,Blue,Genzui,Annie,Desconocido (Desconocido),"14, 4",6/8/15,19008,18042,10113,"Doran's Ring, Shadowflame, Desconocido, Sorcerer's Shoes, Needlessly Large Rod, Desconocido, Stealth Ward",3,1088,10230,15,0,6,15948,16,1,1,7,6,8,0,0,0,0,0,0,0,0,36,676,125,162,15,11,0
LA2_1481228662,859,URF,15.2.652.1536,Blue,Blue,Izanagı,Kaisa,Desconocido (Desconocido),"6, 4",10/6/6,20869,16213,13204,"Long Sword, Sorcerer's Shoes, Muramana, Luden's Tempest, Nashor's Tooth, Needlessly Large Rod, Stealth Ward",5,9242,28971,6,0,10,17551,17,0,0,0,10,6,2,1,0,0,1,0,2,0,85,622,0,111,12,10,0
LA2_1481228662,859,URF,15.2.652.1536,Blue,Blue,Naxeron,Ahri,Desconocido (Desconocido),"4, 6",9/7/7,14029,17529,11956,"Doran's Ring, Desconocido, Sorcerer's Shoes, Hextech Alternator, Desconocido, Rabadon's Deathcap, Stealth Ward",6,1635,15140,7,0,9,17021,17,0,0,1,9,7,2,0,0,0,1,0,1,0,55,1928,101,85,17,11,0
LA2_1481228662,859,URF,15.2.652.1536,Blue,Blue,SoGGeK1ng,Rakan,Desconocido (Desconocido),"14, 4",6/9/10,10274,16627,9115,"Desconocido, Shadowflame, Needlessly Large Rod, Needlessly Large Rod, Desconocido, Desconocido, Stealth Ward",2,1941,5575,10,0,6,15818,16,0,1,0,6,9,1,0,0,0,0,0,0,0,22,2527,55,149,5,5,0
LA2_1481228662,859,URF,15.2.652.1536,Blue,Red,Its Glock oClock,Caitlyn,Desconocido (Desconocido),"4, 6",10/10/8,18955,18830,12014,"The Collector, Infinity Edge, Rapid Firecannon, Desconocido, Long Sword, Long Sword, Stealth Ward",3,5432,5832,8,0,10,11503,14,0,0,0,10,10,1,0,0,0,0,0,1,0,87,1505,73,241,4,4,1
LA2_1481228662,859,URF,15.2.652.1536,Blue,Red,,Leblanc,Desconocido (Desconocido),"4, 14",6/7/2,9494,18936,9167,"Shadowflame, Luden's Tempest, Desconocido, Desconocido, Desconocido, Desconocido, Stealth Ward",3,667,1255,2,0,6,12732,14,0,1,5,6,7,1,0,0,0,0,0,0,0,65,237,4,178,18,12,0
LA2_1481228662,859,URF,15.2.652.1536,Blue,Red,Patricio Miranda,Thresh,Desconocido (Desconocido),"4, 14",5/9/13,12962,18721,9900,"Luden's Tempest, Desconocido, Hextech Alternator, Desconocido, Needlessly Large Rod, Sorcerer's Shoes, Stealth Ward",4,591,655,13,0,5,12728,14,0,0,0,5,9,1,0,0,0,0,0,0,0,49,204,129,201,13,12,0
LA2_1481228662,859,URF,15.2.652.1536,Blue,Red,Chamanter,Velkoz,Desconocido (Desconocido),"4, 21",10/8/6,20799,17712,11104,"Luden's Tempest, Sorcerer's Shoes, Shadowflame, Liandry's Anguish, Desconocido, Desconocido, Stealth Ward",5,2354,5530,6,0,10,13663,15,0,0,2,10,8,2,0,0,0,0,0,1,0,77,120,167,173,14,11,0
LA2_1481228662,859,URF,15.2.652.1536,Blue,Red,WVT Calvo,Chogath,Desconocido (Desconocido),"4, 6",3/5/11,10374,16606,11155,"Desconocido, Shadowflame, Desconocido, Desconocido, Desconocido, Desconocido, Stealth Ward",0,3183,14326,11,0,3,14406,15,0,0,3,3,5,0,0,0,0,0,0,1,0,73,1933,351,127,7,5,0
LA2_1481171772,979,URF,15.2.652.1536,Red,Blue,Ivvy,Cassiopeia,Desconocido (Desconocido),"4, 21",6/9/1,20882,28997,10617,"Liandry's Anguish, Rylai's Crystal Scepter, Refillable Potion, Desconocido, Oblivion Orb, Kindlegem, Stealth Ward",2,472,472,1,0,6,12963,14,0,2,2,6,9,0,0,0,0,0,0,0,0,63,1780,485,264,14,10,0
LA2_1481171772,979,URF,15.2.652.1536,Red,Blue,Amazing Yasuno,Jinx,Desconocido (Desconocido),"4, 6",3/9/7,13848,20215,10121,"Doran's Blade, Desconocido, The Collector, Berserker's Greaves, Zeal, Dagger, Stealth Ward",2,5404,15323,7,0,3,15018,16,0,0,2,3,9,0,0,0,0,0,0,1,0,66,1852,41,153,14,9,0
LA2_1481171772,979,URF,15.2.652.1536,Red,Blue,Yautajh,Zeri,Desconocido (Desconocido),"4, 14",8/9/6,25495,21332,13286,"Desconocido, Runaan's Hurricane, Infinity Edge, Navori Quickblades, Desconocido, Berserker's Greaves, Farsight Alteration",2,2513,5795,6,0,8,14844,16,0,0,2,8,9,1,0,0,0,0,0,1,0,99,1691,60,215,20,12,2
LA2_1481171772,979,URF,15.2.652.1536,Red,Blue,Insane KDA,Alistar,Desconocido (Desconocido),"6, 4",4/7/7,8513,35645,9800,"Sunfire Aegis, Fimbulwinter, Desconocido, Boots of Swiftness, Negatron Cloak, Desconocido, Stealth Ward",3,1373,1373,7,0,4,13797,15,0,0,0,4,7,0,0,0,0,0,0,0,0,45,5516,197,109,12,10,0
LA2_1481171772,979,URF,15.2.652.1536,Red,Blue,Oh u so warm OwO,Leona,Desconocido (Desconocido),"4, 6",6/3/10,16195,22528,9862,"Jak'Sho, The Protean, Desconocido, Mercury's Treads, Bramble Vest, Chain Vest, Ruby Crystal, Stealth Ward",6,68,9462,10,0,6,14622,15,0,1,2,6,3,1,0,0,0,1,0,0,0,27,2734,121,78,21,16,2
LA2_1481171772,979,URF,15.2.652.1536,Red,Red,Sątt,Karma,Desconocido (Desconocido),"4, 6",11/5/18,37293,19925,12560,"Shurelya's Battlesong, Desconocido, Luden's Tempest, Desconocido, Aether Wisp, Desconocido, Stealth Ward",3,5229,5229,18,0,11,17482,17,0,0,0,11,5,1,0,0,0,0,0,1,0,51,3213,216,101,18,11,1
LA2_1481171772,979,URF,15.2.652.1536,Red,Red,FerLaTengoReDura,Sett,Desconocido (Desconocido),"4, 14",10/7/10,20248,26027,13160,"Stridebreaker, Blade of The Ruined King, Desconocido, Desconocido, Desconocido, Desconocido, Stealth Ward",3,7246,11238,10,0,10,15844,16,0,0,2,10,7,1,0,0,0,0,0,3,0,77,6540,128,164,9,4,1
LA2_1481171772,979,URF,15.2.652.1536,Red,Red,elmonjemiroku,Yorick,Desconocido (Desconocido),"14, 4",5/6/12,22594,23064,13006,"Spirit Visage, Frozen Heart, Mercury's Treads, Desconocido, Liandry's Anguish, Doran's Shield, Oracle Lens",3,6366,6366,12,0,5,17794,17,0,2,3,5,6,1,0,0,0,0,0,1,0,92,4462,302,90,35,14,4
LA2_1481171772,979,URF,15.2.652.1536,Red,Red,Naxeron,Morgana,Desconocido (Desconocido),"4, 3",2/4/12,16121,23156,11455,"Doran's Ring, Rylai's Crystal Scepter, Liandry's Anguish, Desconocido, Needlessly Large Rod, Desconocido, Stealth Ward",0,5840,31234,12,0,2,14408,15,0,0,0,2,4,0,0,0,0,1,0,0,0,85,5868,336,119,3,1,1
LA2_1481171772,979,URF,15.2.652.1536,Red,Red,Locx1,Nidalee,Desconocido (Desconocido),"4, 6",9/5/16,26677,18625,11852,"Liandry's Anguish, Horizon Focus, Desconocido, Blighting Jewel, Blasting Wand, Desconocido, Stealth Ward",4,2483,13519,16,0,9,17336,17,0,5,5,9,5,0,0,0,0,0,0,1,0,48,10596,1,82,5,4,0
LA2_1481160071,1215,URF,15.2.652.1536,Red,Blue,Lider Thelar,Maokai,Desconocido (Desconocido),"14, 4",6/4/21,21754,44228,14422,"Kindlegem, Heartsteel, Mercury's Treads, Desconocido, Spirit Visage, Thornmail, Eye of the Herald",3,1286,3755,21,1,6,30628,24,0,0,0,6,4,1,0,0,0,0,0,1,0,73,12275,427,76,18,10,1
LA2_1481160071,1215,URF,15.2.652.1536,Red,Blue,Thelar,Alistar,Desconocido (Desconocido),"4, 3",12/9/14,28636,27722,17326,"Rabadon's Deathcap, Void Staff, Null-Magic Mantle, Desconocido, Shadowflame, Sorcerer's Shoes, Stealth Ward",6,2095,3423,14,0,12,28648,23,0,3,0,12,9,1,0,0,0,0,0,1,0,132,4387,136,266,27,16,0
LA2_1481160071,1215,URF,15.2.652.1536,Red,Blue,Genzui,Vayne,Desconocido (Desconocido),"6, 4",15/12/8,33083,30572,16983,"The Collector, Desconocido, Phantom Dancer, Infinity Edge, Guinsoo's Rageblade, Pickaxe, Stealth Ward",7,11560,13826,8,0,15,29281,23,0,0,0,15,12,5,0,0,0,0,0,2,0,105,1758,22,289,32,19,2
LA2_1481160071,1215,URF,15.2.652.1536,Red,Blue,Izanagı,Briar,Desconocido (Desconocido),"14, 4",15/14/10,35992,42417,15382,"Eclipse, Boots of Swiftness, Blade of The Ruined King, Black Cleaver, Death's Dance, Desconocido, Stealth Ward",3,897,1449,10,0,15,27470,22,0,0,0,15,14,4,0,0,0,0,0,0,0,76,19490,123,400,21,16,0
LA2_1481160071,1215,URF,15.2.652.1536,Red,Blue,Naxeron,Malzahar,Desconocido (Desconocido),"4, 3",7/7/20,25573,30020,16173,"Rylai's Crystal Scepter, Sorcerer's Shoes, Liandry's Anguish, Shadowflame, Rabadon's Deathcap, Desconocido, Stealth Ward",3,3474,8297,20,0,7,30384,24,0,0,0,7,7,1,0,0,0,0,0,1,0,117,601,731,199,8,7,0
LA2_1481160071,1215,URF,15.2.652.1536,Red,Red,gato feo,Gwen,Desconocido (Desconocido),"14, 4",15/9/8,64243,38821,19907,"Banshee's Veil, Shadowflame, Desconocido, Void Staff, Rabadon's Deathcap, Desconocido, Oracle Lens",4,7300,34488,8,0,15,33485,26,0,0,1,15,9,1,1,0,0,1,0,1,0,140,4714,163,270,30,8,7
LA2_1481160071,1215,URF,15.2.652.1536,Red,Red,Apocalepse,Shyvana,Desconocido (Desconocido),"6, 4",7/10/6,25237,37965,16712,"Rabadon's Deathcap, Liandry's Anguish, Riftmaker, Desconocido, Void Staff, Desconocido, Stealth Ward",2,18489,63153,6,0,7,29300,23,0,1,0,7,10,1,0,0,0,2,1,5,0,101,1343,23,288,28,16,0
LA2_1481160071,1215,URF,15.2.652.1536,Red,Red,Sheladio Carrion,Ivern,Desconocido (Desconocido),"7, 4",4/13/14,18735,34176,13839,"Rylai's Crystal Scepter, Nashor's Tooth, Redemption, Desconocido, Kindlegem, Desconocido, Farsight Alteration",2,4049,10967,14,0,4,27134,22,0,0,3,4,13,0,0,0,0,0,0,2,0,52,2070,402,382,18,14,1
LA2_1481160071,1215,URF,15.2.652.1536,Red,Red,DemØngHØsT,Lulu,Desconocido (Desconocido),"4, 7",8/12/8,21730,28515,14460,"Nashor's Tooth, Desconocido, Lich Bane, Rabadon's Deathcap, Amplifying Tome, Giant's Belt, Stealth Ward",2,8028,22572,8,0,8,24892,21,0,1,0,8,12,1,0,0,0,0,1,2,1,75,2276,442,354,5,3,0
LA2_1481160071,1215,URF,15.2.652.1536,Red,Red,Tilted Singed,Graves,Desconocido (Desconocido),"4, 6",12/12/5,30286,28856,18685,"The Collector, Desconocido, Lord Dominik's Regards, Infinity Edge, Bloodthirster, Noonquiver, Oracle Lens",5,3762,31921,5,0,12,32056,25,0,12,5,12,12,2,1,0,0,1,0,1,0,126,1557,312,323,29,14,2
LA2_1481150714,1268,URF,15.2.652.1536,Blue,Blue,Tengen Użui,LeeSin,Desconocido (Desconocido),"4, 3",5/12/13,22483,34855,14327,"Desconocido, Ravenous Hydra, Plated Steelcaps, Eclipse, Long Sword, Black Cleaver, Stealth Ward",2,3104,15759,13,0,5,29423,23,0,1,0,5,12,1,0,0,0,0,0,1,0,65,9034,173,363,19,12,2
LA2_1481150714,1268,URF,15.2.652.1536,Blue,Blue,FissK,Jax,Desconocido (Desconocido),"6, 4",8/14/10,25592,47080,14997,"Trinity Force, Desconocido, Mercury's Treads, Blade of The Ruined King, Spirit Visage, Desconocido, Stealth Ward",2,8908,15608,10,0,8,27163,22,0,0,1,8,14,2,0,0,0,0,0,3,0,55,4872,77,477,20,12,0
LA2_1481150714,1268,URF,15.2.652.1536,Blue,Blue,richbøy,Hwei,Desconocido (Desconocido),"4, 21",16/8/8,56919,31226,18566,"Zhonya's Hourglass, Luden's Tempest, Sorcerer's Shoes, Shadowflame, Rabadon's Deathcap, Desconocido, Stealth Ward",4,683,4084,8,0,16,33535,26,0,0,0,16,8,2,0,0,0,1,0,0,0,124,1133,597,241,34,24,0
LA2_1481150714,1268,URF,15.2.652.1536,Blue,Blue,HIMAWAHRI,MonkeyKing,Desconocido (Desconocido),"3, 4",5/11/7,15232,39075,15719,"Maw of Malmortius, Trinity Force, Mercury's Treads, Desconocido, Caulfield's Warhammer, Pickaxe, Stealth Ward",2,15846,15846,7,0,5,29251,23,0,0,0,5,11,0,0,0,0,0,1,4,1,124,3420,41,351,23,13,0
LA2_1481150714,1268,URF,15.2.652.1536,Blue,Blue,Halitow ,Naafiri,Desconocido (Desconocido),"4, 3",13/9/7,28731,32140,18007,"Youmuu's Ghostblade, Desconocido, Plated Steelcaps, Desconocido, Edge of Night, The Collector, Farsight Alteration",5,6604,24053,7,0,13,33770,26,0,1,10,13,9,3,0,0,0,0,0,1,0,129,6291,31,338,17,10,1
LA2_1481150714,1268,URF,15.2.652.1536,Blue,Red,Lider Thelar,Malphite,Desconocido (Desconocido),"3, 4",9/8/10,23764,30528,14495,"Doran's Ring, Desconocido, Luden's Tempest, Desconocido, Desconocido, Void Staff, Stealth Ward",3,566,18901,10,0,9,29667,24,0,0,0,9,8,1,0,0,0,0,0,0,0,70,1552,362,227,30,18,4
LA2_1481150714,1268,URF,15.2.652.1536,Blue,Red,Thelar,Akali,Desconocido (Desconocido),"4, 3",12/9/12,45554,34812,18206,"Riftmaker, Rabadon's Deathcap, Void Staff, Desconocido, Shadowflame, Plated Steelcaps, Stealth Ward",3,5649,21885,12,0,12,30457,24,0,0,0,12,9,1,0,0,0,0,0,0,0,130,2462,63,289,19,10,1
LA2_1481150714,1268,URF,15.2.652.1536,Blue,Red,Genzui,Kaisa,Desconocido (Desconocido),"3, 4",11/10/12,33575,36377,16740,"Desconocido, Infinity Edge, Lord Dominik's Regards, Berserker's Greaves, Bloodthirster, Zeal, Stealth Ward",2,5149,63589,12,0,11,29033,23,0,0,1,11,10,2,0,0,0,1,0,2,0,109,8297,30,277,26,14,1
LA2_1481150714,1268,URF,15.2.652.1536,Blue,Red,Izanagı,Talon,Desconocido (Desconocido),"14, 4",13/12/11,41071,40989,17149,"Desconocido, Serpent's Fang, Youmuu's Ghostblade, Desconocido, Edge of Night, Lord Dominik's Regards, Stealth Ward",3,4979,13784,11,0,13,30507,24,0,0,5,13,12,0,0,0,0,0,0,1,0,105,4079,147,396,16,13,0
LA2_1481150714,1268,URF,15.2.652.1536,Blue,Red,Naxeron,Jayce,Desconocido (Desconocido),"4, 14",9/8/16,29059,28642,16257,"Serpent's Fang, Youmuu's Ghostblade, Eclipse, Desconocido, Serylda's Grudge, Desconocido, Stealth Ward",5,9673,28467,16,1,9,26873,22,0,0,0,9,8,1,0,0,0,2,1,4,0,76,4213,92,272,10,5,2
LA2_1481147369,819,URF,15.2.652.1536,Blue,Blue,Lider Thelar,Orianna,Desconocido (Desconocido),"6, 4",9/3/5,15964,12668,11617,"Doran's Ring, Luden's Tempest, Desconocido, Desconocido, Needlessly Large Rod, Desconocido, Stealth Ward",4,4624,27693,5,0,9,15632,16,0,1,0,9,3,1,0,0,0,0,0,1,0,82,800,157,43,10,7,0
LA2_1481147369,819,URF,15.2.652.1536,Blue,Blue,Thelar,Illaoi,Desconocido (Desconocido),"4, 3",11/4/5,19020,22128,13619,"Desconocido, Trinity Force, Mercury's Treads, Serrated Dirk, Winged Moonplate, Ruby Crystal, Stealth Ward",7,8990,8990,5,0,11,18429,18,0,0,0,11,4,3,0,0,0,0,0,2,0,102,3988,25,94,13,10,0
LA2_1481147369,819,URF,15.2.652.1536,Blue,Blue,Genzui,Seraphine,Desconocido (Desconocido),"6, 4",5/6/3,13172,14194,10603,"Doran's Ring, Desconocido, Mercury's Treads, Rylai's Crystal Scepter, Kindlegem, Spectre's Cowl, Stealth Ward",2,3345,10348,3,0,5,15749,16,0,0,0,5,6,1,0,0,0,1,0,1,0,104,1225,293,123,5,3,0
LA2_1481147369,819,URF,15.2.652.1536,Blue,Blue,Naxeron,Shen,Desconocido (Desconocido),"4, 14",3/7/10,7420,20298,7684,"Heartsteel, Mercury's Treads, Bami's Cinder, Ruby Crystal, Null-Magic Mantle, Rejuvenation Bead, Stealth Ward",2,1003,12934,10,0,3,13897,15,0,0,0,3,7,1,0,0,0,0,0,0,0,20,827,76,121,4,5,0
LA2_1481147369,819,URF,15.2.652.1536,Blue,Blue,Izanagı,Rakan,Desconocido (Desconocido),"6, 4",7/8/10,15264,18692,9187,"Hextech Rocketbelt, Desconocido, Shadowflame, Amplifying Tome, Amplifying Tome, Cloth Armor, Stealth Ward",2,640,640,10,0,7,14027,15,0,0,0,7,8,0,0,0,0,0,0,0,0,31,3215,96,159,13,12,0
LA2_1481147369,819,URF,15.2.652.1536,Blue,Red,JoKeR648,Vladimir,Desconocido (Desconocido),"6, 14",1/4/5,12290,16123,8443,"Desconocido, Doran's Ring, Shadowflame, Needlessly Large Rod, Desconocido, Slightly Magical Footwear, Oracle Lens",0,469,469,5,0,1,12456,14,0,0,0,1,4,0,0,0,0,0,0,0,0,84,8468,66,89,4,0,0
LA2_1481147369,819,URF,15.2.652.1536,Blue,Red,Maikell,Senna,Desconocido (Desconocido),"6, 4",8/6/6,7553,11820,10530,"The Collector, Berserker's Greaves, Infinity Edge, Rapid Firecannon, Desconocido, Desconocido, Stealth Ward",4,1804,3032,6,0,8,11612,14,0,0,1,8,6,0,0,0,0,0,0,1,0,38,3629,204,68,9,8,0
LA2_1481147369,819,URF,15.2.652.1536,Blue,Red,Qwertys,Blitzcrank,Desconocido (Desconocido),"6, 4",10/9/6,18395,17491,9857,"Desconocido, Desconocido, Sorcerer's Shoes, Hextech Alternator, Needlessly Large Rod, Desconocido, Oracle Lens",4,4975,4975,6,0,10,12802,14,0,2,5,10,9,1,0,0,0,0,0,0,0,35,103,129,179,9,8,0
LA2_1481147369,819,URF,15.2.652.1536,Blue,Red,Ban1s,Evelynn,Desconocido (Desconocido),"11, 4",5/7/9,15898,17642,9852,"Desconocido, Shadowflame, Sorcerer's Shoes, Hextech Alternator, Aether Wisp, Desconocido, Stealth Ward",2,0,22494,9,0,5,12057,14,0,3,0,5,7,0,0,0,0,1,0,0,0,57,1631,36,157,15,8,0
LA2_1481147369,819,URF,15.2.652.1536,Blue,Red,Wînd,Brand,Desconocido (Desconocido),"14, 4",4/9/7,19628,16334,9706,"Liandry's Anguish, Sorcerer's Shoes, Rylai's Crystal Scepter, Desconocido, Lost Chapter, Desconocido, Stealth Ward",2,775,775,7,0,4,13517,15,0,0,6,4,9,0,0,0,0,0,0,0,0,84,512,104,206,12,7,0
LA2_1481139733,1058,URF,15.2.652.1536,Red,Blue,Ekinox,Viktor,Desconocido (Desconocido),"14, 4",3/8/4,24850,25572,12720,"Rabadon's Deathcap, Luden's Tempest, Desconocido, Desconocido, Shadowflame, Desconocido, Stealth Ward",0,1301,3006,4,0,3,19605,18,1,5,3,3,8,0,0,0,0,0,0,0,0,126,339,1135,229,10,6,0
LA2_1481139733,1058,URF,15.2.652.1536,Red,Blue,,Tristana,Desconocido (Desconocido),"4, 3",9/13/5,24711,32279,13151,"Long Sword, The Collector, Desconocido, Desconocido, Lord Dominik's Regards, Vampiric Scepter, Stealth Ward",2,1036,1036,5,0,9,20205,18,0,0,0,9,13,0,0,0,0,0,0,0,0,90,4881,90,300,21,10,2
LA2_1481139733,1058,URF,15.2.652.1536,Red,Blue,estoy settado ,TwistedFate,Desconocido (Desconocido),"4, 6",7/15/10,18203,34548,11194,"Doran's Blade, Pickaxe, Blade of The Ruined King, Berserker's Greaves, Kraken Slayer, B. F. Sword, Stealth Ward",0,3153,6609,10,0,7,18103,17,0,0,1,7,15,1,0,0,0,0,0,1,0,33,2864,101,345,11,6,1
LA2_1481139733,1058,URF,15.2.652.1536,Red,Blue,Shikael,MissFortune,Desconocido (Desconocido),"4, 21",8/7/4,20074,22121,13297,"Control Ward, Doran's Blade, Desconocido, Infinity Edge, Lord Dominik's Regards, The Collector, Stealth Ward",3,10266,29389,4,0,8,19360,18,0,0,4,8,7,2,0,0,0,0,0,3,0,78,2408,128,207,28,16,0
LA2_1481139733,1058,URF,15.2.652.1536,Red,Blue,Kumbaya My Lord,Xerath,Desconocido (Desconocido),"4, 6",5/3/6,24864,14900,11719,"Luden's Tempest, Desconocido, Horizon Focus, Shadowflame, Desconocido, Desconocido, Stealth Ward",3,920,6842,6,0,5,18242,17,0,0,1,5,3,1,0,0,0,1,0,0,0,67,476,106,94,22,14,0
LA2_1481139733,1058,URF,15.2.652.1536,Red,Red,T1 Cumayusi,Braum,Desconocido (Desconocido),"4, 6",11/6/11,18785,32728,14074,"Heartsteel, Mercury's Treads, Sunfire Aegis, Desconocido, Wit's End, Tiamat, Stealth Ward",3,7462,12646,11,0,11,23952,20,0,2,3,11,6,2,0,0,0,0,1,2,0,65,2851,183,102,23,16,1
LA2_1481139733,1058,URF,15.2.652.1536,Red,Red,Lider Thelar,Nunu,Desconocido (Desconocido),"3, 4",12/7/5,24075,29119,13565,"Sorcerer's Shoes, Hextech Rocketbelt, Desconocido, Void Staff, Needlessly Large Rod, Desconocido, Stealth Ward",4,355,36221,5,1,12,25705,21,0,0,1,12,7,1,0,0,0,2,0,1,1,56,11256,143,159,19,12,0
LA2_1481139733,1058,URF,15.2.652.1536,Red,Red,Izanagı,Varus,Desconocido (Desconocido),"6, 4",8/3/9,34426,21959,14303,"Youmuu's Ghostblade, Boots of Swiftness, Edge of Night, Serylda's Grudge, Long Sword, Long Sword, Farsight Alteration",4,10119,41146,9,0,8,25327,21,0,0,0,8,3,0,0,0,0,0,1,3,0,102,2161,256,67,13,11,0
LA2_1481139733,1058,URF,15.2.652.1536,Red,Red,Naxeron,Vladimir,Desconocido (Desconocido),"4, 14",1/7/5,10297,35496,12790,"Cosmic Drive, Sorcerer's Shoes, Rabadon's Deathcap, Hextech Alternator, Amplifying Tome, Desconocido, Stealth Ward",0,8177,19128,5,0,1,23398,20,0,0,0,1,7,0,0,0,0,0,1,3,0,90,21977,58,161,9,5,0
LA2_1481139733,1058,URF,15.2.652.1536,Red,Red,kim chaewonn,Nautilus,Desconocido (Desconocido),"14, 4",14/9/7,32925,22460,16568,"Desconocido, Shadowflame, Sorcerer's Shoes, Rabadon's Deathcap, Blighting Jewel, Desconocido, Stealth Ward",5,12690,18791,7,0,14,24414,21,0,0,0,14,9,0,0,0,0,0,0,2,0,115,1635,390,239,10,6,1
LA2_1481135143,1242,URF,15.2.652.1536,Blue,Blue,L0RDPAD,Taliyah,Desconocido (Desconocido),"14, 4",8/11/9,28828,27383,16737,"Luden's Tempest, Shadowflame, Desconocido, Rabadon's Deathcap, Void Staff, Aether Wisp, Stealth Ward",2,7473,21221,9,0,8,26883,22,0,0,1,8,11,1,0,0,0,2,0,3,0,104,771,490,361,22,12,1
LA2_1481135143,1242,URF,15.2.652.1536,Blue,Blue,3th PraGOD,Hecarim,Desconocido (Desconocido),"6, 14",12/7/9,32683,37248,16115,"Eclipse, Youmuu's Ghostblade, Trinity Force, Desconocido, The Collector, Serrated Dirk, Stealth Ward",5,13159,43423,9,0,12,27021,22,1,1,0,12,7,1,0,0,0,0,0,4,1,90,10874,85,270,20,11,1
LA2_1481135143,1242,URF,15.2.652.1536,Blue,Blue,chimu carries u,Karma,Desconocido (Desconocido),"4, 14",10/7/16,23280,50542,16240,"Fimbulwinter, Desconocido, Desconocido, Abyssal Mask, Desconocido, Negatron Cloak, Stealth Ward",3,4760,13722,16,0,10,28055,23,0,0,8,10,7,0,0,0,0,0,0,0,0,67,12593,262,216,9,4,2
LA2_1481135143,1242,URF,15.2.652.1536,Blue,Blue,T1 Leona Rhoades,Khazix,Desconocido (Desconocido),"4, 6",10/11/6,25655,34875,16999,"Desconocido, Youmuu's Ghostblade, Serrated Dirk, Edge of Night, Serylda's Grudge, Eclipse, Stealth Ward",4,4545,54634,6,1,10,28704,23,0,2,8,10,11,0,0,0,0,2,1,1,0,103,7406,330,251,24,12,2
LA2_1481135143,1242,URF,15.2.652.1536,Blue,Blue,ekep54,Sett,Desconocido (Desconocido),"4, 6",4/8/10,18227,32717,14705,"Blade of The Ruined King, Maw of Malmortius, Caulfield's Warhammer, Mercury's Treads, Black Cleaver, Long Sword, Stealth Ward",0,8566,49508,10,0,4,28845,23,0,0,1,4,8,0,0,0,0,0,0,2,0,95,7903,131,241,32,20,2
LA2_1481135143,1242,URF,15.2.652.1536,Blue,Red,Lider Thelar,Vi,Desconocido (Desconocido),"3, 4",11/12/5,30212,32551,14943,"The Collector, Eclipse, Serpent's Fang, Serylda's Grudge, Pickaxe, B. F. Sword, Stealth Ward",3,3282,3282,5,0,11,29432,23,0,0,0,11,12,1,0,0,0,0,1,1,0,78,1309,145,307,31,19,0
LA2_1481135143,1242,URF,15.2.652.1536,Blue,Red,Thelar,Blitzcrank,Desconocido (Desconocido),"4, 3",6/7/11,22280,25284,14276,"Ruby Crystal, Lich Bane, Void Staff, Desconocido, Shadowflame, Boots, Farsight Alteration",3,1527,1527,11,0,6,25190,21,0,0,0,6,7,1,0,0,0,0,0,1,0,60,487,204,188,10,8,1
LA2_1481135143,1242,URF,15.2.652.1536,Blue,Red,Genzui,Malphite,Desconocido (Desconocido),"14, 4",10/5/2,24752,16605,14647,"Lich Bane, Shadowflame, Sorcerer's Shoes, Void Staff, Needlessly Large Rod, Desconocido, Stealth Ward",5,7084,7084,2,0,10,18927,18,0,0,2,10,5,0,0,0,0,0,0,2,0,83,480,439,101,18,11,0
LA2_1481135143,1242,URF,15.2.652.1536,Blue,Red,Izanagı,Jinx,Desconocido (Desconocido),"6, 4",7/10/9,32341,26550,15149,"Desconocido, Infinity Edge, Berserker's Greaves, Lord Dominik's Regards, Runaan's Hurricane, Vampiric Scepter, Farsight Alteration",2,714,1682,9,0,7,26494,22,0,0,0,7,10,1,0,0,0,0,0,0,0,125,2285,78,273,20,15,0
LA2_1481135143,1242,URF,15.2.652.1536,Blue,Red,Naxeron,Kayle,Desconocido (Desconocido),"4, 14",10/11/8,30651,37462,16599,"Nashor's Tooth, Berserker's Greaves, Lich Bane, Rabadon's Deathcap, Shadowflame, Desconocido, Oracle Lens",3,7478,9452,8,0,10,28395,23,0,0,2,10,11,1,0,0,0,0,0,1,0,104,17249,242,291,20,10,0
LA2_1478377487,715,ARAM,15.1.649.4112,Red,Blue,benji253,Zeri,Desconocido (Desconocido),"4, 6",8/7/7,15641,12208,8684,"Desconocido, Mercury's Treads, Runaan's Hurricane, Vampiric Scepter, Pickaxe, Desconocido, Poro-Snax",3,0,0,7,0,8,9148,12,0,0,0,8,7,3,1,0,0,0,0,0,0,46,780,43,125,0,0,0
LA2_1478377487,715,ARAM,15.1.649.4112,Red,Blue,OrcaInvisible,Kaisa,Desconocido (Desconocido),"4, 6",9/4/10,15506,8557,9562,"Nashor's Tooth, Refillable Potion, Tear of the Goddess, Horizon Focus, Liandry's Anguish, Desconocido, Desconocido",5,0,0,10,0,9,10839,13,0,0,0,9,4,2,0,0,0,0,0,0,0,27,1175,26,88,0,0,0
LA2_1478377487,715,ARAM,15.1.649.4112,Red,Blue,aIL2XgPZtv,LeeSin,Desconocido (Desconocido),"6, 4",4/7/16,8023,17313,7528,"Desconocido, Boots, Caulfield's Warhammer, Desconocido, Executioner's Calling, Pickaxe, Poro-Snax",2,0,0,16,0,4,9517,12,0,0,3,4,7,1,0,0,0,0,0,0,0,12,2758,59,166,0,0,0
LA2_1478377487,715,ARAM,15.1.649.4112,Red,Blue,Honaline,Varus,Desconocido (Desconocido),"4, 6",1/5/9,7062,6715,6373,"The Collector, Tear of the Goddess, Ionian Boots of Lucidity, Desconocido, Desconocido, Desconocido, Poro-Snax",0,0,0,9,0,1,6142,10,0,0,0,1,5,0,0,0,0,0,0,0,0,5,342,103,91,0,0,0
LA2_1478377487,715,ARAM,15.1.649.4112,Red,Blue,Naxeron,Smolder,Desconocido (Desconocido),"4, 6",2/11/18,15505,15756,7505,"Muramana, Trinity Force, Ionian Boots of Lucidity, Desconocido, Desconocido, Desconocido, Poro-Snax",2,0,0,18,0,2,9630,12,0,0,0,2,11,0,0,0,0,0,0,0,0,34,819,101,212,0,0,0
